"Post #","Board","Post Type","Theme","Title","Description","Alt Text","AI Prompt","In-App Text Hook","Status","Posting Day","Slot","SL Post Time"
"1","Future Living & Off-Grid Tech","Static Image","Glass / Black Volcanic Rock Geothermal Ocean Pod","Black Volcanic Rock Glass Pod | Geothermal Off-Grid Architecture 2026","Save this for your off-grid architecture and volcanic coast board. A full-glass minimal pod anchored directly on black basalt volcanic rock above a natural geothermal tide pool — EcoFlow Delta Pro on the basalt terrace below the glass, geothermal steam rising from the thermal water, the Atlantic horizon filling every wall. This is the off-grid formula built in raw earth and glass. #GlassCabin #OffGridLiving #VolcanicArchitecture #FutureLiving #GeothermalPower #OffGridTech #CoastalArchitecture","Minimal full-glass rectangular pod on black basalt volcanic rock above geothermal tidal pool, warm amber interior visible through all glass walls, EcoFlow Delta Pro on basalt terrace, Atlantic ocean horizon at golden hour, geothermal steam rising","Hyper-realistic 9:16 vertical photo, Style A Quiet Luxury. A perfectly rectangular full-glass pod cabin anchored on a dramatic shelf of black basalt volcanic rock directly above a natural geothermal tidal pool. All four walls are floor-to-ceiling glass revealing the warm amber interior: a minimal platform bed facing the ocean, a hanging ceramic lamp, an EcoFlow Delta Pro stack on the flat black basalt terrace outside the glass with green LED charge bars. Steam rises from the geothermal tidal pool below in wisps of white against the dark basalt. The Atlantic Ocean stretches to a hammered gold horizon at golden hour. Maximum contrast: warm amber glass interior, jet-black basalt rock, gold ocean. No people. 8k, cinematic volcanic coast architectural photography, golden hour.","Black rock. Glass walls. Geothermal.","Ready","Day 1 — Tue May 13","Static-1","7:30am"
"2","Smart Pet Wellness","Static Image","Adventure / Golden Retriever Dawn Glass Float-House Mirror Lake","Golden Retriever Glass Float House Dawn | Mirror Lake Dog Photography 2026","Save this for your golden retriever and lake life board. A golden retriever at the bow of a floating glass cabin at pre-dawn — gold fur catching the very first light above a mirror-flat mountain lake, the glass float house glowing amber behind. Pure stillness. Pure dog. Pure morning. #GoldenRetriever #LakeDog #FloatHouse #AdventureDog #MirrorLake #DawnDog #DogPhotography","Golden Retriever sitting at bow of glass float house pontoon deck at pre-dawn, gold fur catching first pink-gold light, mirror-flat mountain lake doubling the reflection of dog and cabin below, EcoFlow visible through glass walls, mountain silhouettes behind in cobalt","Hyper-realistic 9:16 vertical photo, Style A Quiet Luxury. A large adult golden retriever sits absolutely still at the very edge of the floating pontoon deck of a glass float-house cabin at pre-dawn. The dog faces the mountains, gold fur beginning to catch the first pink-gold light on the horizon. Behind the dog, the full-glass cabin interior glows warm amber — an EcoFlow Delta Pro stack visible through the glass, its green LED charge bars reflected in the still lake water below. The completely still mountain lake creates a perfect mirror reflection of the golden retriever, the glass float-house, and the mountain silhouettes. Low mist sits at water level in thin horizontal bands. The sky transitions from deep cobalt to soft blush pink at the horizon. No people. 8k, pre-dawn lake dog portrait photography, perfect mirror reflections.","Gold fur. Mirror lake. First light.","Ready","Day 1 — Tue May 13","Static-2","9:30am"
"3","Future Living & Off-Grid Tech","Static Image","Glass / Granite Cliff Overhang A-Frame Autumn Forest","Granite Cliff Overhang A-Frame Autumn | Off-Grid Glass Architecture 2026","Save this for your A-frame and autumn architecture board. The A-frame built under a granite cliff overhang — the rock forming a natural protective roof over the glass triangle, burning gold and crimson forest below, EcoFlow on the cedar ledge. Nature already did the architecture. You just add the glass. #AFrame #GlassCabin #GraniteOverhang #OffGridLiving #FutureLiving #AutumnArchitecture #CliffCabin","A-frame glass cabin nestled directly under a dramatic granite cliff overhang in peak autumn colour, triangular glass face exposed to burning gold and crimson forest below, EcoFlow Delta Pro in custom steel cradle on cliff face, warm amber interior visible through glass","Hyper-realistic 9:16 vertical photo, Style B Dynamic Viral. A classic A-frame glass cabin is positioned directly under a massive natural granite cliff overhang — the overhanging rock forms a natural canopy above the A-frame roof. The full triangular glass face looks out over a dense autumn forest in full peak colour: burning gold, deep crimson, amber orange. The A-frame interior is warm amber through the glass: cream linen bed, oak furniture. An EcoFlow Delta Pro is mounted in a custom steel cradle integrated into the cliff face on the cedar ledge — green LED bar glowing. The granite overhang above is grey-pink and mossy with fern fronds at the rim. Bold text overlay at bottom in clean white sans-serif: ""NATURE BUILT THE ROOF. YOU BUILD THE LIFE."" No people. 8k, cinematic autumn architectural photography.","Nature built the roof.","Ready","Day 1 — Tue May 13","Static-3","11:30am"
"4","Smart Pet Wellness","Static Image","Indoor Luxury / British Shorthair Rammed Earth Morning Light","British Shorthair Rammed Earth Interior | Quiet Luxury Cat Photography 2026","Save this for your British Shorthair and quiet luxury interior board. A blue British Shorthair on a rammed earth window ledge at morning light — the horizontal layers of the earth wall behind, the pine forest beyond the glass, that perfect round grey face in perfect morning light. Quiet luxury does not need to try. #BritishShorthair #QuietLuxury #RammedEarth #CatLife #IndoorCat #MinimalistHome #CatPhotography","Blue British Shorthair cat sitting on rammed earth interior window ledge in warm morning light, horizontal ochre-grey rammed earth wall layers behind cat, pine forest through large glass window in soft focus, warm light creating rim-light on plush grey fur, copper eyes off-camera","Hyper-realistic 9:16 vertical photo, Style A Quiet Luxury. A perfectly groomed blue British Shorthair cat sits centred on a wide rammed-earth window ledge inside a minimal cabin interior. The rammed earth wall behind shows its characteristic horizontal layers: ochre, ash-grey, cream, soft sienna. A large floor-to-ceiling glass window is immediately to the cat's left — pine forest extends beyond in soft-focus morning light. Warm morning light enters from the right, creating a warm rim-light on the cat's famously plush blue-grey double coat. The cat's large round face and copper eyes look calmly off-camera in classic British Shorthair composure. The window ledge is solid dark oak. Interior colour palette: earth tones, warm grey, oak. No people. 8k, quiet luxury interior cat portrait, morning light.","Earth walls. Round face. Pure quiet.","Ready","Day 1 — Tue May 13","Static-4","1:30pm"
"5","Code. Build. Ship. — Freelance Tech Life","Static Image","Bridge / Off-Grid Glass Cabin Developer Workspace Golden Hour","Off-Grid Glass Cabin Coding Setup | Aesthetic Developer Workspace 2026","Save this for your dream remote work and developer setup board. What if your development environment was inside an off-grid glass cabin at golden hour? 34-inch ultrawide. Mechanical keyboard. EcoFlow powering everything. Pacific Ocean horizon. This is what software engineering looks like when you build your own rules. #RemoteWork #DeveloperSetup #OffGridWork #SoftwareEngineer #FreelanceDev #CodingSetup #WorkFromAnywhere","Minimal developer workspace inside off-grid glass cabin at golden hour, 34-inch ultrawide monitor showing dark-theme VS Code with TypeScript code, matte black mechanical keyboard, EcoFlow Delta Pro in corner with green LEDs, Pacific Ocean horizon through full glass wall","Hyper-realistic 9:16 vertical photo, Style A Quiet Luxury. A hyper-minimal developer workspace inside a full-glass off-grid cabin at golden hour. The desk: natural solid oak, minimal footprint. The setup: a single 34-inch ultrawide monitor displaying a dark-theme code editor with clean TypeScript code visible — syntax highlighted in amber, teal, and white. A premium mechanical keyboard in matte black. A single Anglepoise lamp in matte black. In the corner of the glass room, an EcoFlow Delta Pro x2 stack with all green LEDs powers the entire setup. Through the full glass wall behind the monitor: the Pacific Ocean at golden hour, hammered gold horizon, sky deepening from amber to rose. The glass reflects both the code on screen and the ocean behind simultaneously. No person visible. 8k, cinematic developer workspace photography, golden hour, glass cabin.","Code anywhere. Power everything.","Ready","Day 1 — Tue May 13","SE-Lifestyle","3:30pm"
"6","Code. Build. Ship. — Freelance Tech Life","Static Image","Infographic / Freelance SE Client Acquisition Stack 2026","How I Find Startup Clients as a Software Engineer | 2026 Acquisition Stack","Save this for your freelance strategy and client acquisition board. This is the exact stack a software engineer uses to go from zero to fully booked in 2026. No cold calls. No LinkedIn spam. Just a system that compounds. Save this and build it. #SoftwareEngineer #FreelanceDev #ClientAcquisition #StartupLife #FreelanceTech #IndieHacker #BuildInPublic","Minimalist dark vertical infographic titled The 2026 Freelance SE Client Stack with 5 numbered items, deep charcoal background with amber-gold number accents, clean sans-serif editorial typography, blueprint grid lines","Clean editorial infographic, 9:16 vertical, Style B Dynamic Viral. Background: deep charcoal (#1a1a1a) with subtle grid lines like a technical blueprint. Header in bold white sans-serif at top: THE 2026 FREELANCE SE CLIENT STACK. Below, 5 numbered steps in large amber-gold numbers with white descriptions: 1. Pinterest Aesthetic Content — the discovery layer, your portfolio is a pin board. 2. A Single-Page Portfolio Site — brutalist minimal, mobile-first, built in Next.js. 3. One Clear Offer — not 'I do everything' but 'I build MVPs for SaaS founders in 6 weeks'. 4. One Published Case Study — real result, real numbers, real stack. 5. One Warm DM System — personal, brief, already warm because they found you. Footer small text in amber: Build the system once. Let it run. Colour palette: deep charcoal, amber-gold, white. No photography. Pure editorial typography.","Build the system once.","Ready","Day 1 — Tue May 13","SE-Infographic","8:30pm"
"7","Future Living & Off-Grid Tech","Static Image","Glass / Earth-Sheltered Hillside Pod Blue Hour Zero Footprint","Earth-Sheltered Glass Pod Hillside | Off-Grid Architecture Blue Hour 2026","Save this for your earth-sheltered home and sustainable architecture board. A minimal glass pod emerging from a grass-covered hillside at blue hour — the earth roof blending into the meadow above, warm amber glow from the glass face below, EcoFlow on the stone threshold. From above it is just meadow. From the front it is everything. #EarthSheltered #GreenRoof #OffGridLiving #FutureLiving #SustainableHome #HillsideHome #EcoArchitecture","Minimal glass pod partially submerged in grass-covered hillside at blue hour, grass sod roof continuing seamlessly into meadow above, warm amber interior glow visible through full glass face, EcoFlow Delta Pro on flat stone threshold step outside, deep cobalt blue hour sky","Hyper-realistic 9:16 vertical photo, Style B Dynamic Viral. A minimal full-glass rectangular pod built into the side of a gentle grass-covered hillside at blue hour — the glass face is the only visible element from the front, the entire structure otherwise covered seamlessly by earth and meadow above. The grass-covered sod roof continues directly into the hillside above without interruption — from above it is simply meadow. The glass face glows warm amber from inside: a platform bed, a reading lamp, a wool blanket in ochre. An EcoFlow Delta Pro is set on a flat stone threshold step in front of the glass, green LED charge bar visible in the blue dusk. The meadow grass above the pod: dew-wet and luminous. The sky behind the hillside: deep cobalt blue hour. Bold text overlay at bottom in white: ZERO FOOTPRINT. FULL GLASS. OFF-GRID. No people. 8k, blue hour earth-sheltered architectural photography.","Zero footprint. Off-grid.","Ready","Day 2 — Wed May 14","Static-1","7:30am"
"8","Smart Pet Wellness","Static Image","Adventure / Siberian Husky Mountain Fog Dawn Sprint","Siberian Husky Mountain Fog Sprint | Adventure Dog Photography 2026","Save this for your Siberian Husky and mountain dog board. A Siberian Husky at full sprint through mountain fog at dawn — the mist parting as the dog cuts through it, blue eyes locked forward, dawn light breaking in warm gold shafts. This breed was engineered for exactly this. #SiberianHusky #AdventureDog #MountainFog #HuskyLife #WinterDog #DawnSprint #DogPhotography","Siberian Husky at full sprint through thin mountain fog at dawn, all four paws slightly off ground, icy blue eyes focused forward through mist, golden dawn light shafts breaking horizontally through fog from left, mountain outline in pale blue-grey behind","Hyper-realistic 9:16 vertical photo, Style B Dynamic Viral. Shot from ground level across a mountain slope at dawn. A tri-colour Siberian Husky — black, white, copper — runs at full speed directly toward the camera through thin drifting mountain fog. All four paws are slightly off ground at near-peak stride — motion at paws contrasts with the tack-sharp face. Icy blue eyes locked forward through the mist with complete focus. The dawn light breaks horizontally through the fog in warm gold shafts from the left, illuminating the dog's fur from the side — white portions glow gold in the backlight, black portions catch the rim-light. Mountain outline behind: pale blue-grey in morning mist. Bold text overlay at bottom in white: FOG DOESN'T SLOW THEM DOWN. No people beyond the dog. 8k, dawn mountain dog photography, fog, ground level.","Fog doesn't slow them down.","Ready","Day 2 — Wed May 14","Static-2","9:30am"
"9","Future Living & Off-Grid Tech","Static Image","Glass / Fjord Floating Glass Cabin Northern Lights Mirror Reflection","Floating Glass Cabin Fjord Northern Lights | Off-Grid Architecture 2026","Save this for your northern lights and floating cabin board. A full-glass floating cabin on a Norwegian fjord at midnight — the aurora painting the glass walls emerald, the mirror-flat fjord below doubling the northern lights. EcoFlow charged. Total silence. #NorthernLights #AuroraBorealis #FjordCabin #FloatingCabin #GlassCabin #OffGridLiving #FutureLiving","Full-glass floating cabin on mirror-still Norwegian fjord at midnight, vivid emerald aurora borealis overhead, aurora reflected perfectly in black fjord water below alongside cabin, warm amber interior through all glass walls, EcoFlow Delta Pro on low pontoon deck with green LEDs, sheer granite fjord walls both sides","Hyper-realistic 9:16 vertical photo, Style A Quiet Luxury. A perfectly rectangular full-glass cabin floats on the utterly still water of a deep Norwegian fjord at midnight. All four glass walls reveal the warm amber interior: a platform bed with white linen, a pendant lamp, stacked books, an EcoFlow Delta Pro in the corner with green LED charge bars. The Aurora Borealis fills the sky in vivid sweeping curtains of emerald green with violet at the outer edges. The fjord water is mirror-flat — the aurora, the glass cabin, and the dark granite fjord walls all reflected perfectly in the black water below, creating an infinite vertical composition. The EcoFlow on the low exterior pontoon deck, green LED reflected in fjord water. No people. 8k, aurora fjord architectural photography, midnight mirror reflections.","Fjord mirror. Aurora above.","Ready","Day 2 — Wed May 14","Static-3","11:30am"
"10","Smart Pet Wellness","Static Image","Indoor Luxury / Maine Coon Glass Skylight Studio Afternoon Light","Maine Coon Glass Skylight Studio | Quiet Luxury Cat Photography 2026","Save this for your Maine Coon and quiet luxury interior board. A Maine Coon directly under a glass skylight in a white studio — a perfect vertical shaft of afternoon light cutting through and illuminating that extraordinary tabby fur from directly above. Light was designed for this cat specifically. #MaineCoon #QuietLuxury #CatLife #GlassSkylight #IndoorCat #LuxuryInterior #CatPhotography","Large Maine Coon tabby cat sitting on white oak floor directly under square glass ceiling skylight, vertical shaft of warm afternoon light illuminating fur from above, extraordinary layered fur detail in gold and shadow, pure white minimal studio interior around cat","Hyper-realistic 9:16 vertical photo, Style A Quiet Luxury. A large adult Maine Coon tabby cat sits on a white oak floor directly under a large square glass skylight panel set into the white ceiling. A vertical shaft of warm afternoon light falls directly on the cat from above — the light creates extraordinary illumination of the Maine Coon's long layered tabby fur: the guard coat lit gold, the undercoat visible in shadow. The Maine Coon's large tufted ears and distinctive ruff are fully illuminated. Its amber-green eyes look slightly off-camera with quiet intensity. The studio interior is absolute white: white plaster walls, white oak floor — the only warmth is the cat and the light shaft. No people. 8k, quiet luxury cat portrait photography, directional natural skylight.","Light finds the best subject.","Ready","Day 2 — Wed May 14","Static-4","1:30pm"
"11","Code. Build. Ship. — Freelance Tech Life","Static Image","Bridge / Pet Wellness App UI on Laptop in Off-Grid Glass Cabin","Pet Wellness App UI Design | Off-Grid Studio Build Log 2026","Save this for your UI design and pet tech startup board. Designing a pet wellness platform from inside an off-grid glass cabin studio. The dog health dashboard on screen — vet telehealth flow, activity tracking, medication scheduler — this is what a software engineer builds for a founder with a vision. I can build yours. Save this for when you have the idea. #UIDesign #PetWellness #SoftwareEngineering #AppDesign #FreelanceDev #StartupBuild #ProductDesign","MacBook Pro on natural oak desk in off-grid glass cabin showing pet wellness app UI dashboard — dog health tracking with clean pastel card components, vet booking flow, activity ring — pine forest through glass wall behind, warm studio morning light","Hyper-realistic 9:16 vertical photo, Style A Quiet Luxury. A MacBook Pro 16-inch on a minimal natural oak desk inside a full-glass cabin studio. The screen shows a clean modern pet wellness app UI: a dog health tracking dashboard with pastel card components showing a weight graph with golden retriever silhouette icon, a vet appointment scheduler in soft teal, a medication tracker in warm amber, an activity ring in Apple Health style. The design is clean, minimal, pastel-on-white with dark typography. Through the full glass wall of the cabin behind the laptop: a dense pine forest in morning light. A single Anglepoise lamp in matte black provides interior light. The glass reflects both the UI and the forest simultaneously. No person's face visible. 8k, cinematic desk photography, glass cabin studio.","Your pet wellness idea. My build.","Ready","Day 2 — Wed May 14","SE-Lifestyle","3:30pm"
"12","Code. Build. Ship. — Freelance Tech Life","Static Image","Infographic / 7 High-Demand Software Engineering Niches 2026","7 Software Engineering Niches With Highest Client Demand in 2026","Save this for your freelance strategy and career planning board. Not all software engineering skills are equal in 2026. These 7 niches have the highest client demand and the worst talent supply. Save this — the market gap is your opportunity. #SoftwareEngineer #FreelanceDev #TechNiches #StartupLife #CareerDev #IndieHacker #BuildInPublic","Dark architectural infographic listing 7 software engineering niches with highest demand, deep charcoal background with amber-gold demand meter bars and accent numbers, clean editorial sans-serif typography","Clean editorial infographic, 9:16 vertical, Style B Dynamic Viral. Background: deep charcoal with subtle dot-grid. Header in bold white: 7 SE NICHES. HIGHEST CLIENT DEMAND. 2026. Below, 7 rows each with a large amber number, the niche name in bold white, a horizontal amber demand bar, and a one-line grey description. Niches: 1. AI Integration Engineers — LLM APIs and RAG pipelines, demand bar 95%. 2. Full-Stack SaaS Builders — solo-build MVPs for founders. 3. Mobile App Developers — pet tech, health, fintech verticals. 4. No-Code to Custom Code Migrations. 5. API and Webhook Specialists — automation stack builders. 6. Dev-Sec-Ops Solo Infrastructure — startups outsourcing ops. 7. Niche Vertical SaaS — pet wellness, home tech, eco-tech. Footer in amber: The niche is the moat. Colour palette: charcoal, amber, white. No photography.","The niche is the moat.","Ready","Day 2 — Wed May 14","SE-Infographic","8:30pm"
"13","Future Living & Off-Grid Tech","Static Image","Glass / Scandinavian Stone and Glass Fjord Cliff Retreat","Scandinavian Stone and Glass Fjord Retreat | Off-Grid Architecture 2026","Save this for your Scandinavian architecture and Norwegian cabin board. Raw Norwegian granite on three sides. Full floor-to-ceiling glass on the fourth. The fjord 50 metres directly below the stone terrace. EcoFlow on the granite shelf. The most honest architecture formula on the feed. #ScandinavianArchitecture #NorwegianCabin #FjordCabin #StoneAndGlass #OffGridLiving #FutureLiving #CabinPorn","Scandinavian cliff retreat combining rough-cut Norwegian granite walls on three sides with full-glass front face, natural stone terrace cantilevering 50m over fjord edge, EcoFlow Delta Pro on steel wall bracket on stone terrace, morning fjord mist layer far below","Hyper-realistic 9:16 vertical photo, Style A Quiet Luxury. A Scandinavian cliff retreat combining raw load-bearing Norwegian granite stone walls on three sides with a full floor-to-ceiling glass front face. The natural stone terrace extends slightly over the cliff edge — the fjord 50 metres directly below. The granite walls are rough and uncut, found in-situ on the Norwegian hillside. The glass front reveals a warm minimal interior: a low platform bed facing the fjord, a cast iron wood-burning stove, an EcoFlow Delta Pro in the corner with green charge bars. On the stone terrace: the EcoFlow is also externally wall-mounted on a steel bracket. The fjord below is in morning mist — a white layer of mist sits on the dark water, the far cliff wall just visible above the mist. Dawn light: pink-gold on the granite above the mist. No people. 8k, cinematic Scandinavian cliff architectural photography.","Raw granite. Glass. 50m above the fjord.","Ready","Day 3 — Thu May 15","Static-1","7:30am"
"14","Smart Pet Wellness","Static Image","Adventure / Pembroke Welsh Corgi Highland Mist Golden Hour Portrait","Corgi Highland Mist Golden Hour | Adventure Dog Photography 2026","Save this for your Corgi and highland landscape board. A Pembroke Welsh Corgi standing in highland mist at golden hour — the mist burning off around the dog, golden light cutting through, both ears fully erect, the expression of an animal that knows exactly where it belongs. #Corgi #PembrokeWelshCorgi #HighlandDog #AdventureDog #GoldenHour #MistDog #DogPhotography","Pembroke Welsh Corgi standing in highland meadow mist at golden hour, both pointed ears fully erect, fox-red and white coat heavily backlit by low golden sun creating luminous fur halo, thin wisps of morning mist drifting through heather around paws, purple heather moorland","Hyper-realistic 9:16 vertical photo, Style A Quiet Luxury. A perfectly built Pembroke Welsh Corgi stands in a highland meadow at golden hour as thin morning mist burns off around it. Shot from low ground level — the Corgi at camera height. Both pointed ears fully erect, face turned three-quarters toward the camera. Its fox-red and white coat is heavily backlit by the low golden hour sun — the white ruff and ear tips create a luminous fur halo in the backlight. Thin wisps of morning mist drift around the dog's paws and through heather stems. The highland landscape behind: rolling moorland, heather in amber-purple, thin mist across the valley below, mountain ridgeline in pale gold-pink at the horizon. No people, no leash. 8k, golden hour highland dog portrait photography, low angle, backlit.","Highland mist. Ears up. Pure Corgi.","Ready","Day 3 — Thu May 15","Static-2","9:30am"
