"Post #","Board","Post Type","Theme","Title","Description","Alt Text","AI Prompt","In-App Text Hook","Status","Posting Day","Slot","SL Post Time"
"15","Future Living & Off-Grid Tech","Static Image","Interior / Multi-Material Glass Cabin Corten Steel Fireplace","Glass Cabin Corten Steel Fireplace Interior | Weathered Material Architecture 2026","Save this for your cabin interior and modern fireplace board. Inside the off-grid cabin: a raw Corten steel fireplace — the rust-coloured oxidized patina forming naturally over time — surrounded by full glass walls. Material honesty meets minimalism. The fire is burning. You are warm. #CabinInterior #CorstenSteel #Fireplace #OffGridLiving #MaterialArchitecture #MinimalInterior #ArchitectureDesign","Interior of glass cabin with prominent tall Corten steel fireplace with birch fire burning, rust-red oxidized steel color, full glass walls surrounding interior revealing forest outside, minimal cream furnishings, warm firelight, EcoFlow partially visible in corner","Hyper-realistic 9:16 vertical photo, Style B Dynamic Viral. Interior shot of a full-glass cabin. Central element: a floor-to-ceiling Corten steel fireplace — the steel has weathered naturally into deep rust-red oxidized patina, a beautiful warm red-brown colour. The fireplace is open on one side with a real birch log fire burning, flames visible, warm amber light falling across the interior. Inside the cabin: minimal furnishings in cream and natural oak, a reading chair with a thick wool blanket, a small wooden table. The full glass walls surround the interior — the forest outside is visible on all sides in soft bokeh. An EcoFlow unit is partially visible in a corner, barely integrated. Warm firelight is the dominant light source, creating strong shadows and texture on the Corten steel. Bold text overlay at bottom in white: STEEL. FIRE. GLASS. ALIVE. No people. 8k, cinematic interior cabin fireplace photography, Corten steel patina detail.","Steel. Fire. Alive.","Ready","Day 3 — Thu May 24","Static-3","11:30am"
"16","Smart Pet Wellness","Static Image","Wilderkind / Red Fox Winter Forest Snow Twilight Magic","Red Fox Winter Forest Twilight | Wilderkind Taiga Aesthetic 2026","Save this for your Wilderkind and winter wildlife board. The red fox at twilight in the snow-covered taiga — the rust-red coat creating a burning contrast against the white landscape, amber eyes catching the last light, the silence of a northern forest in winter. Wilderkind visual poetry. #Wilderkind #RedFox #WinterForest #TaigaFox #WildlifeTwilight #NatureAesthetic #AnimalPhotography","Red fox standing in deep snow-covered taiga forest at twilight, luminous rust-red coat creating warm color contrast against pure white snow and landscape, amber eyes glowing in purple twilight light, dark taiga spruce forest in background creating depth","Hyper-realistic 9:16 vertical photo, Style A Quiet Luxury. Wilderkind aesthetic. A red fox stands in the deep snow-covered taiga forest at twilight. The snow is pristine and unbroken — the fox has left fresh prints leading to its position. The fox's rust-red coat stands in extraordinary colour contrast: vivid warm red against the pure white snow. The amber eyes catch the last twilight light — a cool blue-purple twilight glow — creating a striking colour contrast between the warm fox and cool light. The taiga forest behind: dark silhouetted spruce trees receding into the purple twilight distance. The fox's breath is not visible — it's too subtle, but the profound silence and cold is felt. Shot from slightly lower angle — the fox positioned above. No people. 8k, twilight wildlife portrait photography, winter forest, colour contrast.","Rust against white.","Ready","Day 3 — Thu May 24","Static-4","1:30pm"
"17","Code. Build. Ship. — Freelance Tech Life","Static Image","Bridge / DevSecOps Solo Infrastructure Workspace Setup","Solo Infrastructure Engineer SaaS Backend | The DevOps Developer Life","Save this for your SaaS infrastructure and DevOps career board. One engineer. Full infrastructure stack visible on three monitors. GitHub, Docker logs, CloudWatch metrics. This is what it looks like when a founder says 'we need someone who can own the whole stack.' Save this. #DevSecOps #SoftwareEngineer #Infrastructure #SaaS #DevOps #FreelanceDev #BackendEngineering","Three-monitor workspace in glass cabin showing GitHub CI/CD pipeline on left, Docker container logs in center, CloudWatch/Datadog metrics dashboard on right, all dark-theme terminals, glass cabin forest backdrop, morning light","Hyper-realistic 9:16 vertical photo, Style A Quiet Luxury. A three-monitor standing desk setup in a full-glass cabin. Left monitor: GitHub Actions CI/CD pipeline running — green checkmarks showing successful deploys. Centre monitor: Docker container logs scrolling in a dark terminal — container health checks, deployment logs. Right monitor: CloudWatch metrics dashboard showing server health, response time graphs, error rate trending down. All three screens dark-theme, professional technical interfaces. The natural oak desk, an untouched coffee mug. A matte black Anglepoise lamp. Behind the desk: the full glass wall shows the dense pine forest in morning light. An EcoFlow stack against the glass, nearly invisible. No person visible. 8k, cinematic technical workspace photography, infrastructure monitoring setup.","Own the whole stack.","Ready","Day 3 — Thu May 24","SE-Lifestyle","3:30pm"
"18","Code. Build. Ship. — Freelance Tech Life","Static Image","Infographic / The Complete Freelance SE Lead Gen Funnel 2026","How a Software Engineer Built a $120k/Year Lead Generation Machine","Save this for your freelance lead generation and client acquisition board. From zero followers to $120k annual recurring revenue in 18 months. This is the exact system. Save this. #FreelanceSE #LeadGeneration #SoftwareEngineer #ClientAcquisition #IndieHacker #BuildInPublic #SaaSFunnel","Dark clean infographic showing 5-stage lead gen funnel from content creation through close, starting wide at top narrowing to closed deals at bottom, deep charcoal background with amber-gold stage numbers, ascending revenue indicators on right side","Clean editorial infographic, 9:16 vertical, Style B Dynamic Viral. Background: deep charcoal. Title in bold white: THE SE LEAD GEN MACHINE — $120K ARR IN 18 MONTHS. Subtitle in amber: Exact system used by a freelance software engineer. Below, a vertical funnel with 5 stages, each narrower than above. Stage 1 CONTENT POSTING (Month 1-3) — 6 pins/week across Pinterest, blog posts, Twitter. Stage 2 AUDIENCE BUILD (Month 4-6) — 5k followers, email list to 200. Stage 3 PORTFOLIO & OFFER (Month 6-9) — One clear offer: 'I build MVPs for SaaS founders in 6 weeks'. Stage 4 WARM INBOUND (Month 9-15) — 3-5 warm leads per month from audience. Stage 5 CLOSE & UPSELL (Month 15-18) — $120k ARR from 8-10 clients. Right side: Revenue graph ascending from $0 to $120k. Footer: Build in public. Let the work speak. Colour: charcoal, amber, white. No photography.","Build in public. Work speaks.","Ready","Day 3 — Thu May 24","SE-Infographic","8:30pm"
"19","Future Living & Off-Grid Tech","Static Image","Glass / Dramatic Sea Stack Glass Cabin Wave-Crash Design","Sea Stack Glass Cabin Wave Crash | Dramatic Coastal Architecture 2026","Save this for your coastal architecture and dramatic cabins board. A glass cabin built on a sea stack — waves crashing against the base 80 metres below, the cabin high enough to feel the spray and hear the power, EcoFlow on the interior ledge. Architecture that does not hide from nature. #CoastalArchitecture #GlassCabin #SeaStack #OffGridLiving #FutureLiving #DramaticArchitecture #WavesArchitecture","Minimal glass cabin on top of dramatic tall sea stack rocky outcrop, white ocean waves crashing violently at base 80m below creating white spray, cabin high above, warm amber interior visible through glass, EcoFlow inside, dark stormy sky meeting white-water ocean","Hyper-realistic 9:16 vertical photo, Style A Quiet Luxury. A minimal rectangular full-glass cabin is built on top of a dramatic sea stack — a tall rocky outcrop rising 80 metres directly from the ocean. At the base of the sea stack: powerful white-water ocean waves crash against the rock, creating explosions of white spray that rise halfway up the stack. The cabin, positioned at the very top of the stack, is high enough to be above the spray zone but close enough to feel the power and hear the roar. Inside the cabin: warm amber glow, minimal furnishings, an EcoFlow Delta Pro visible on an interior shelf with green LEDs. The ocean behind: dark grey-white, stormy mood. The sky: dramatic clouds with breaks of lighter grey. The composition emphasizes the precarious beauty — total exposure, total power, total honesty. No people. 8k, cinematic sea stack cabin photography, dramatic wave composition.","Above the crash. Inside the power.","Ready","Day 4 — Fri May 25","Static-1","7:30am"
"20","Smart Pet Wellness","Static Image","Adventure / British Shorthair Grey Cat Beach Tidal Pool Explorer","British Shorthair Tidal Pool Adventure | Quiet Luxury Cat Beach Photography 2026","Save this for your British Shorthair and beach cat board. The British Shorthair at the edge of a tide pool — that perfect round face, those amber eyes watching the starfish and anemones in the still water, the beach rocks, morning mist, quiet blue light. Cats deserve adventures too. #BritishShorthair #TidalPool #BeachCat #AdventureCat #CatPhotography #CoastalLife #QuietLuxury","Plump blue British Shorthair cat sitting at edge of tide pool on dark volcanic rock, looking down at starfish and anemones visible in mirror-still tide pool water, cat's face in profile showing characteristic round features and large amber eyes, morning mist and beach rocks, cool blue light","Hyper-realistic 9:16 vertical photo, Style A Quiet Luxury. A blue British Shorthair cat sits at the edge of a tide pool on dark volcanic rock at a rocky beach. The tide pool water is mirror-still, and through the clear water: starfish, anemones, and small fish are visible below. The British Shorthair's characteristic round face is shown in side profile — the large round amber eyes are focused downward at the tide pool's inhabitants with quiet fascination. The plush grey-blue double coat is clearly detailed. Morning mist floats just above the beach. The light: cool blue morning light. Dark volcanic rock surrounding the tide pool. Distant white ocean visible beyond. No people. Shot to emphasize the cat's wonder and the quiet moment. 8k, quiet luxury cat exploration photography, tide pool reflection.","Starfish watching.","Ready","Day 4 — Fri May 25","Static-2","9:30am"
"21","Future Living & Off-Grid Tech","Static Image","Structural / Glass Cabin Exposed Steel Frame Architecture Detail","Glass Cabin Steel Frame Structural Art | Raw Architecture 2026","Save this for your architectural detail and structural design board. The beauty is in the structure — the exposed matte black steel frame meeting the glass panels, all joints visible and honest, no hiding. This is structural expressionism. Save this. #StructuralArchitecture #SteelDesign #ArchitectureDesign #FutureLiving #ArchitectureDetail #MinimalDesign #BuildHonest","Close-up detail of glass cabin exterior showing junction of full-glass panel and matte black steel I-beam frame, steel welded joints visible and detailed, glass panel edge-mounted directly on steel without trim, minimal architectural expression, forest and sky visible through glass pane","Hyper-realistic 9:16 vertical photo, Style A Quiet Luxury. A detailed close-up of a glass cabin's exterior structural connection. The shot shows the precise junction where a full-glass panel meets a matte black steel I-beam frame. The steel frame is fully exposed — no trim, no covering — showing the raw welded joint detail: the bead pattern, the surface treatment. The glass panel edge-mounts directly onto the steel with minimal hardware visible. The structural honesty is the design statement. Through the glass: the blurred forest and sky behind the cabin. The light: morning golden hour hitting the steel, creating fine shadows on the weld details. The composition: tight enough to emphasize the structural detail and material honesty. No people. 8k, architectural detail photography, structural joints, morning light.","Honesty in every joint.","Ready","Day 4 — Fri May 25","Static-3","11:30am"
"22","Smart Pet Wellness","Static Image","Wilderkind / Grey Wolf Snowy Forest Predator Gaze Portrait","Grey Wolf Snow Forest | Wilderkind Predator Portrait 2026","Save this for your Wilderkind big animal and wolf aesthetic board. The grey wolf in deep winter snow — that piercing yellow-amber predator gaze locked on camera, the thick winter coat, the boreal forest depth behind. Wilderkind: ancient power in a landscape of white and dark. #Wilderkind #GreyWolf #Wolf #WildlifeTaiga #PredatorPortrait #WinterWildlife #AnimalPhotography","Large grey wolf standing in deep snow-covered taiga forest, thick winter coat with grey and white fur layers, piercing yellow-amber predator eyes staring directly at camera with focused intensity, dark boreal forest behind, low cold twilight light creating shadows on snow","Hyper-realistic 9:16 vertical photo, Style A Quiet Luxury. Wilderkind aesthetic. A large adult grey wolf stands in the deep snow-covered taiga forest. The wolf's thick winter coat is clearly detailed: layered grey and white fur, dense undercoat. The piercing yellow-amber predator eyes stare directly at the camera with intense focused intelligence. The head and shoulders are rimlit by cold twilight light — the fur catches light creating texture and depth. The boreal forest behind: dark silhouetted spruce trees receding into blue-purple shadow. Fresh snow covers the ground and hangs on branches. The wolf is alone — a predator in its landscape. Shot from slightly lower angle to emphasize the predatory presence. No people. 8k, twilight wildlife predator portrait photography, winter forest, direct gaze.","Predator. Power. Snow.","Ready","Day 4 — Fri May 25","Static-4","1:30pm"
"23","Code. Build. Ship. — Freelance Tech Life","Static Image","Bridge / Custom Analytics Dashboard SaaS Builder Workspace","Building a Custom Analytics Startup | The Backend Engineer's Desk 2026","Save this for your SaaS startup ideas and analytics platform board. A backend engineer building a new analytics startup from a glass cabin — the custom dashboard architecture visible on screen, the off-grid power stack beside the desk, mountain backdrop. This is what the next $100M SaaS looks like at day one. #SaaS #Analytics #SoftwareEngineer #Startup #FreelanceDev #BackendEngineering #BuildInPublic","Dual-monitor desk setup in glass cabin showing custom analytics dashboard design on main monitor and VS Code backend API on secondary, dark-theme code visible, glass cabin interior, mountain peaks visible through glass wall, morning light on desk","Hyper-realistic 9:16 vertical photo, Style A Quiet Luxury. A dual-monitor standing desk in a full-glass cabin studio. Main monitor: A custom analytics dashboard design showing real-time metrics visualizations — line charts in amber-gold, a heat map showing user activity by geography, a funnel conversion chart. Secondary monitor: VS Code showing TypeScript backend code for the analytics API engine. The desk: natural oak, minimal. A single Anglepoise lamp. Behind the monitors: the full glass wall shows snow-covered mountain peaks at morning light. An EcoFlow Delta Pro is positioned on a shelf beside the desk, green LEDs visible. The glass reflects both the code and the mountain backdrop. No person visible. 8k, cinematic SaaS workspace photography, analytics dashboard.","The next startup. Day one.","Ready","Day 4 — Fri May 25","SE-Lifestyle","3:30pm"
"24","Code. Build. Ship. — Freelance Tech Life","Static Image","Infographic / The Highest-Paying SaaS Verticals for Software Engineers 2026","Which SaaS Vertical Pays Software Engineers the Most in 2026?","Save this for your career planning and startup ideas board. These 5 SaaS verticals pay software engineers 30-60% more than generalist dev work. Build something in one of these. #SoftwareEngineer #SaaS #CareerGrowth #StartupVerticals #Fintech #HealthTech #IndieHacker","Dark market-research infographic showing 5 SaaS vertical categories with average developer salary/revenue rankings, deep charcoal background with amber salary comparisons and upward trending indicators on right side","Clean editorial infographic, 9:16 vertical, Style B Dynamic Viral. Background: deep charcoal. Title in bold white at top: THE 5 HIGHEST-PAYING SAAS VERTICALS 2026. Subtitle in amber: Average developer salary + equity potential. Below, 5 ranked verticals left-aligned, each with an upward amber bar and salary data right-aligned. 1. FINTECH (embedded payments, APIs) — Average dev: $165k salary + 0.5% equity. 2. HEALTHTECH (HIPAA compliance, medical records) — $155k + 0.4% equity. 3. PROPTECH (real estate, lease management) — $148k + 0.35% equity. 4. EDTECH (LMS, course platforms) — $128k + 0.3% equity. 5. CLIMATE (carbon accounting, ESG) — $142k + 0.35% equity. Footer: The vertical determines your value. Choose wisely. Colour: charcoal, amber, white. No photography.","The vertical determines your value.","Ready","Day 4 — Fri May 25","SE-Infographic","8:30pm"
"25","Future Living & Off-Grid Tech","Static Image","Glass / Minimalist Desert Glass Pod Sunrise Rock Formation","Desert Glass Pod Sunrise Rock | Minimalist Architecture 2026","Save this for your desert architecture and minimal design board. A glass pod in the desert at sunrise — set within a natural rock formation creating a natural alcove, the pod almost disappears into the rock, morning pink light fills the space. Minimalism in harmony with geology. #DesertArchitecture #GlassPod #MinimalArchitecture #OffGridLiving #FutureLiving #RockFormation #ArchitectureDesign","Minimal full-glass rectangular pod nestled within dramatic rust-red desert rock formation creating natural alcove, pink-gold sunrise light flooding into rocky alcove illuminating glass pod interior, warm amber interior glow visible through glass, EcoFlow on interior shelf, desert floor sand around rocks","Hyper-realistic 9:16 vertical photo, Style A Quiet Luxury. A minimal rectangular full-glass pod is positioned within a natural desert rock formation — the surrounding rocks create a natural alcove that frames the pod perfectly. The rocks are rust-red and ochre sandstone. At sunrise, pink-gold light floods horizontally into the rock alcove, illuminating the glass pod completely. The interior of the pod glows warm amber: a platform bed, a single Anglepoise lamp, an EcoFlow on a shelf with green LEDs. The glass walls are completely transparent — inside and outside blur into one. The desert floor: sand and scattered rocks. The sky above the rock formation: pink-gold and warming. Composition: the rocks frame the pod like art in a gallery. No people. 8k, cinematic desert pod architecture, sunrise rock light.","Desert rock. Desert light.","Ready","Day 5 — Sat May 26","Static-1","7:30am"
"26","Smart Pet Wellness","Static Image","Adventure / Maine Coon Mountain Peak Morning Explorer Cat","Maine Coon Mountain Peak Summit | Adventure Cat Photography 2026","Save this for your Maine Coon and mountain adventure board. The Maine Coon at a mountain peak at sunrise — that extraordinary ruff and ear tufts catching the first light, those huge paws on alpine rock, the valley far below, a cat built for altitude. #MaineCoon #MountainCat #AdventureCat #PeakSummit #MorningLight #CatPhotography #MountainLife","Large Maine Coon cat standing on rocky alpine peak at sunrise, distinctive large ear tufts and full ruff highlighted by warm amber sunrise backlight, enormous paws gripping rocky alpine ground, deep valley far below in blue shadow, mountain horizon in golden light","Hyper-realistic 9:16 vertical photo, Style A Quiet Luxury. A large adult Maine Coon stands on a rocky alpine peak at sunrise. The Maine Coon's most distinctive features are fully illuminated: the large ear tufts are backlit by the warm amber sunrise light, creating a luminous outline. The full dense ruff around the neck is highlighted. The enormous paws are clearly visible gripping the alpine rock firmly — Maine Coons are built for mountain terrain. The Maine Coon's amber eyes look outward over the landscape with alert confidence. Behind the cat: a deep valley drops away far below in blue shadow. The horizon: distant mountains in golden sunrise light. The rock beneath the cat: grey alpine stone with patches of lichen. Shot from slightly lower angle to emphasize the commanding position. No people. 8k, alpine cat adventure photography, summit positioning, sunrise backlight.","Built for altitude.","Ready","Day 5 — Sat May 26","Static-2","9:30am"
"27","Future Living & Off-Grid Tech","Static Image","Glass / Glass Platform Over Canyon Geological Masterpiece","Glass Cabin Canyon Platform | Geological Minimalism 2026","Save this for your canyon architecture and geological landscape board. A glass cabin cantilevered over a deep canyon — the canyon rock layers visible through the glass floor, the striations telling millennia of earth history, you are floating above deep time. #CanyonArchitecture #GeologicalLandscape #GlassPlatform #OffGridLiving #FutureLiving #ArchitectureDesign #LandscapeArchitecture","Minimal glass cabin cantilevered on steel beam over deep red-rock canyon, transparent glass floor showing striations and geological layers in canyon walls far below through floor glass, warm amber interior visible through cabin glass walls, EcoFlow interior shelf, canyon depth emphasized by vertical scale","Hyper-realistic 9:16 vertical photo, Style B Dynamic Viral. A minimal rectangular glass cabin is cantilevered on a single steel beam over a deep red-rock canyon. The cabin is positioned to maximize the canyon view — particularly the transparent glass floor. Through the glass floor: the striations and geological layers visible in the canyon walls far below, the rock layers showing millions of years of earth history, rust-red and ochre coloration. The cabin interior: warm amber glow from inside, a minimal sleeping platform, an EcoFlow on a shelf with green LEDs. The sheer scale of the canyon drop is emphasized. The glass walls are clear — the cabin becomes part of the landscape. Bold text overlay at bottom in white: YOU ARE FLOATING ABOVE DEEP TIME. No people. 8k, cinematic canyon platform architecture, geological landscape.","Above deep time.","Ready","Day 5 — Sat May 26","Static-3","11:30am"
"28","Smart Pet Wellness","Static Image","Wilderkind / Black Leopard Night Rainforest Moonlit Gaze","Black Leopard Rainforest Night | Wilderkind Nocturnal Aesthetic 2026","Save this for your Wilderkind nocturnal animal and big cat board. The black leopard in the rainforest at night — barely visible rosette patterns in the black coat revealed only by moonlight, eyes glowing amber in darkness, the mystery of a nocturnal predator. Wilderkind: the animal that owns the night. #Wilderkind #BlackLeopard #Leopard #RainforestNight #NocturnalAnimal #BigCat #AnimalPhotography","Black leopard in dense rainforest at night, barely visible rosette pattern in black coat visible only in moonlight as faint texture, vivid amber eyes glowing directly at camera in complete darkness, rainforest canopy shadow creating frame, mysterious nocturnal atmosphere","Hyper-realistic 9:16 vertical photo, Style A Quiet Luxury. Wilderkind aesthetic. A black leopard is in the dense rainforest at night. The coat appears almost pure black, but in the faint moonlight filtering through the canopy, the rosette pattern is barely visible — ghost markings in shadow. The defining element: the amber eyes glowing with predatory intensity directly at the camera in the darkness. The eyes are vivid and sharp. The rainforest around: deep shadow, barely discernible shapes of broad leaves and vines, the complete darkness of a tropical night. A single beam of moonlight hits the leopard's shoulders and eyes. Shot to emphasize mystery, power, and nocturnal presence. No people. 8k, nocturnal wildlife portrait photography, rainforest night, glowing eyes.","The eyes own the night.","Ready","Day 5 — Sat May 26","Static-4","1:30pm"
