"Post #","Board","Post Type","Theme","Title","Description","Alt Text","AI Prompt","In-App Text Hook","Status","Posting Day","Slot","SL Post Time"
"1","Future Living & Off-Grid Tech","Static Image","Metal Art / Corten Dome","Corten Steel Dome | Metal Art Off-Grid Architecture 2026","Save this for your metal art and off-grid cabin board. A geodesic dome clad entirely in hand-welded corten steel panels — the building itself is metal art. Cracked glass entrance door with warm amber interior glowing against a volcanic ridge at dawn. EcoFlow Delta Pro on the exterior platform. #MetalArt #CortenSteel #OffGridDome #GeodesicDome #WeldedArchitecture #FutureLiving #OffGridLiving","Corten steel geodesic dome with visible weld seams on volcanic ridge at dawn, floor-to-ceiling glass entrance door cracked open revealing warm amber interior, EcoFlow Delta Pro on exterior steel platform","Hyper-realistic 9:16 vertical photo. A geodesic dome clad entirely in heavy corten steel panels with raw, iridescent weld seams proudly visible on every panel join. The dome sits on a dark, dramatic volcanic ridge at dawn. The structure is an architectural statement in metal art. At its base, a floor-to-ceiling glass entrance door is cracked open at 45 degrees, revealing a blazing warm amber interior glow. An EcoFlow Delta Pro power station sits directly on the exterior perforated-steel platform, its green LED charge bar visible in the cold dawn light. The sky above is a cold blue-purple transitioning to pale gold at the horizon. Maximum colour temperature contrast between warm amber door spill and cold volcanic grey stone. No people, 8k, cinematic architectural photography.","Steel. Welded. Off-Grid.","Ready","May 1","Static-1","7:30am"
"2","Smart Pet Wellness","Static Image","Watercraft / Dock Dog","The Dock Dog: Black Lab at the Float House | Off-Grid Lake Life 2026","Save this for your adventure dog and lake life board. A black Labrador sitting at the edge of a floating timber dock at pre-dawn, a modern glass float house glowing amber behind it. Still water. Mirror mountains. #BlackLab #DockDog #FloatHouse #LakeLife #OffGridPets #AdventureDog #WaterDog","Black Labrador sitting at edge of a floating timber dock, modern glass float house glowing amber behind, perfect mirror reflection on pre-dawn lake, mist and mountains","Hyper-realistic 9:16 vertical photo. A large, glossy black Labrador Retriever sitting perfectly still at the very edge of a floating timber dock, legs hanging over the edge, looking out across the water. Behind the dog, a modern glass-and-black-timber floating cabin glows intensely with warm amber interior light. The entire scene is reflected perfectly in the mirror-flat pre-dawn lake water below — the dog, the glowing cabin, and the dark blue silhouetted mountains all doubled in the reflection. Low mist hangs an inch above the water surface. Extreme colour temperature contrast: amber interior glow against cold blue-grey pre-dawn. No people, 8k, cinematic aquatic pet photography.","Still Water. Loyal Dog.","Ready","May 1","Static-2","9:30am"
"3","Future Living & Off-Grid Tech","Static Image","Woodworking / Cedar Entrance Threshold","The Cedar Threshold: Hand-Jointed Off-Grid Cabin Entrance 2026","Save this for your woodworking and cabin entrance board. A hand-built cedar cabin front — visible mortise-and-tenon joinery on the structural beams, a massive natural timber-frame door swung open showing warm amber sanctuary inside. Snow mountains behind. Jackery on cedar deck. #Woodworking #CedarCabin #CabinEntrance #HandBuilt #OffGridCabin #DoorDesign #MortiseAndTenon","Hand-built cedar cabin front with visible mortise-and-tenon joinery, massive natural timber-frame entrance door swung open showing warm amber interior, Jackery Explorer on cedar deck, snow mountains behind","Hyper-realistic 9:16 vertical photo. Shot from just outside the entrance of a masterfully hand-built cedar off-grid cabin at dawn. The structural beams are heavy-duty cedar with visible, perfectly executed mortise-and-tenon joinery — the wood craft is the art. The entrance features a massive, thick natural timber door swung fully open at 90 degrees, its raw cedar surface oiled and glowing in the dawn light. Through the open doorway, the interior blazes with warm amber light, illuminating the oiled cedar floor that extends outwards onto the deck. On the wide cedar plank deck to the right of the door, a Jackery Explorer 2000 power station sits, its display screen lit. Behind the cabin, a spectacular snow-capped mountain range lines the horizon under a pale blue-gold dawn sky. No people, 8k, architectural woodworking photography.","Hand-built. Every joint.","Ready","May 1","Static-3","11:30am"
"4","Smart Pet Wellness","Static Image","Quiet Morning / Glass Threshold Dog","First Light: Husky at the Glass Door | Off-Grid Cabin Morning 2026","Save this for your husky and cabin morning board. A Siberian Husky sitting quietly in an open floor-to-ceiling glass door at dawn, warm amber light rim-lighting its coat from behind. Misty pine forest outside. Pure off-grid morning quiet. #SiberianHusky #QuietMorning #CabinMorning #GlassDoor #HuskyLife #OffGridDog #DawnLight","Siberian Husky sitting at open floor-to-ceiling glass cabin door at dawn, warm amber interior rim-lights the dog from behind, misty pine forest ahead, cold blue-grey morning light","Hyper-realistic 9:16 vertical photo. A beautiful tri-colour Siberian Husky is sitting calmly directly in the open threshold of a floor-to-ceiling glass sliding door of an off-grid cabin. The camera is outside looking in, with the dog facing outward toward the camera. The cabin interior behind the dog blazes with warm, rich amber light, creating a stunning warm rim-light that glows through the dog's thick fur edges in liquid gold. Outside, the dawn scene is cold, misty, and peaceful — a blue-grey pine forest with soft morning mist hanging between the trees. The dog's ice-blue eyes are completely relaxed and still. The threshold between warm inside and cold outside is the emotional core of the image. No people, 8k, cinematic cabin pet morning photography.","Quiet morning. Open door.","Ready","May 1","Static-4","1:30pm"
"5","Wild Stay | Off-Grid Escapes","Static Image","Watercraft / Floating Lake Cabin","The Float: Off-Grid Glass Lake Platform Cabin | Wild Stay 2026","Save this for your wild stay and floating home board. A glass-fronted floating cabin on a still alpine lake at twilight — warm amber interior reflected perfectly on the dark water. Solar array on roof, EcoFlow on the exterior deck. Drift into off-grid. #FloatingHome #WildStay #OffGridWatercraft #LakeCabin #GlassArchitecture #Darecations #SolarPowered","Floating glass and black timber cabin on still alpine lake at twilight, warm amber interior reflecting on dark water, solar array on roof, EcoFlow on exterior deck","Hyper-realistic 9:16 vertical photo. A modern floating platform cabin constructed of matte black structural timber and floor-to-ceiling glass rests on the perfectly still surface of an alpine lake at deep twilight blue hour. The entire interior glows with warm, sophisticated amber light that pours through the glass facade and reflects in a brilliant golden pillar down into the mirror-flat dark water below. A flat solar array covers the black roof. On the exterior timber boardwalk along the side of the floating cabin, an EcoFlow Delta Pro power station sits with its green LED charge bars glowing. Mist rolls in low across the water from the dark mountain walls behind. Maximum colour temperature contrast: warm golden reflection in the cold, dark blue alpine lake. Text overlay at bottom: 'Drift. Dream. Off-grid.' No people, 8k, cinematic floating architecture photography.","Floating. Solar. Wild.","Ready","May 1","Trend-Slot","3:30pm"
"6","Future Living & Off-Grid Tech","Idea Pin Video","Metal Art / Steel Weld Reveal Video","Weld Marks: Metal Art Off-Grid Architecture | Steel Cabin Reveal","Watch the metal art details. Extreme close-up on raw corten steel weld seams — iridescent heat marks, structural beauty. Camera pulls back to reveal a full off-grid steel cabin on a mountain ridge with amber warmth glowing through the glass. #MetalArt #WeldedSteel #OffGridArchitecture #CabinReveal #SteelCabin #ArchitectureVideo","Cinematic video starting in extreme close-up on iridescent corten steel weld seams, pulling back to reveal full metal art off-grid cabin on mountain ridge, warm amber glow through glass facade","Cinematic 9:16 vertical video. The video opens in extreme macro close-up on the surface of a corten steel architectural panel. The heat-iridescent weld seam fills the frame — purples, blues, and golds in the oxidised metal. The camera slowly pulls back and the scale of the structure emerges. A massive corrugated corten steel off-grid cabin comes into frame, perched on a dramatic alpine ridge. As the camera continues pulling back, the full floor-to-ceiling glass wall of the cabin comes into view, glowing with intense warm amber interior light that blazes against the cold blue mountain sky. An EcoFlow Delta Pro is visible on the exterior grate deck. The weld marks continue across every visible surface. Ambient sound of cold mountain wind. 8k, no people.","Steel. Every weld.","Ready","May 1","Video","8:30pm"
"7","Future Living & Off-Grid Tech","Static Image","Dome Formula / Northern Lights Snow Dome","The Snow Dome: Off-Grid Geodesic Sanctuary at Night | Northern Lights 2026","Save this for your off-grid dome and northern lights board. A glass-panel geodesic dome on a frozen tundra at night — northern lights dancing above, warm amber interior blazing through every glass panel. EcoFlow Delta Pro in the snow outside. The perfect off-grid night shelter. #GeodesicDome #NorthernLights #OffGridDome #AuroraBorealis #GlassDome #FutureLiving #SnowCabin","Glass geodesic dome on frozen tundra at night, northern lights dancing above, warm amber interior glowing through every glass panel, EcoFlow Delta Pro in snow outside with green LED visible","Hyper-realistic 9:16 vertical photo. A large glass-panel geodesic dome sits in the centre of a vast, flat, frozen tundra snowfield at deep night. Every triangular glass panel of the dome is perfectly lit from within by a rich, warm amber interior glow, making the entire structure look like a lantern dropped from the sky onto the snow. Directly above the dome, the northern lights — vivid ribbons of electric green and violet — arc and shimmer across the black star-filled sky. On the snow just outside the dome entrance, an EcoFlow Delta Pro power station sits, its green LED charge bar bright against the white snow. The amber warmth reflected on the surrounding snow contrasts perfectly with the electric cold of the aurora above. No people, 8k, cinematic geodesic dome polar photography.","Dome. Aurora. Off-grid.","Ready","May 2","Static-1","7:30am"
"8","Smart Pet Wellness","Static Image","Cycling / Trail Dog at Basecamp","The Trail Setter: Vizsla at the Off-Grid Cycling Basecamp 2026","Save this for your cycling dog and trail basecamp board. A red Vizsla alert and ready at a rustic off-grid cycling basecamp — a high-end gravel bike leaned against a cedar log shelter behind it. Mountain pass at dawn. Born to ride. #Vizsla #CyclingDog #TrailDog #GravelBike #AdventureDog #OffGridCamping #BaseCamp","Red Vizsla dog in alert pose at rustic off-grid cycling basecamp, high-end mud-splattered gravel bike leaning against cedar log shelter behind, mountain pass at dawn","Hyper-realistic 9:16 vertical photo. A sleek, muscular red Vizsla dog stands in a sharp, alert pose on a rugged mountain trail at dawn. Behind the dog, a rustic off-grid cedar log shelter forms the backdrop. Leaning casually against the cedar wall is a high-end, mud-splattered gravel adventure bicycle — the kind used for multi-day mountain bikepacking routes. The dog's amber-gold coat is illuminated perfectly by the cold golden dawn light coming over the ridge behind the shelter. The colour harmony between the Vizsla's coat, the cedar logs, and the golden sunrise is intentional and striking. A small Jackery power station is visible just inside the shelter doorway. No people, 8k, cinematic outdoor cycling pet photography.","Trail dog. Ready.","Ready","May 2","Static-2","9:30am"
"9","Future Living & Off-Grid Tech","Static Image","Aircraft / Hangar Conversion Cabin","The Hangar Loft: Converted Private Airstrip Off-Grid Cabin 2026","Save this for your aircraft and off-grid architecture board. A converted private aircraft hangar — matte black steel cladding, one full glass wall open to a private grass airstrip at snow mountain dawn. Warm amber loft interior blazing through glass. Jackery on the steel deck. The ultimate aviation retreat. #AircraftHangar #OffGridCabin #HangarHome #Airstrip #OffGridLiving #FutureLiving #AviationArchitecture","Converted matte black aircraft hangar with full glass wall open to private grass airstrip at mountain dawn, warm amber loft interior visible, small aircraft parked outside, Jackery on steel grate deck","Hyper-realistic 9:16 vertical photo. A stunning architectural conversion of a private aircraft hangar into a luxurious off-grid cabin retreat. The hangar is clad in matte black corrugated steel on three sides. The fourth side — facing the private grass airstrip — is entirely floor-to-ceiling glass. The interior is a warm, amber-lit loft space with exposed steel beams and timber accents, glowing intensely through the glass facade. Outside on the airstrip, a small single-engine bush plane is tied down on the grass, its propeller still. The surrounding mountain valley is crisp dawn blue-white snow. A Jackery Explorer 2000 Pro sits on the exterior steel grate deck beside the main glass door, powering the structure. The scale contrast between the dark industrial hangar and the glowing living space is striking. No people, 8k, architectural aviation lifestyle photography.","Hangar turned home.","Ready","May 2","Static-3","11:30am"
"10","Smart Pet Wellness","Static Image","Aircraft / Airstrip Dog","The Co-Pilot: Belgian Malinois at the Off-Grid Airstrip 2026","Save this for your dog and aviation adventure board. A Belgian Malinois in full action pose at a private highland airstrip — converted hangar cabin glowing amber behind it, a light aircraft as backdrop, golden hour light. Born to fly. #BelgianMalinois #AirstripDog #AdventureDog #AviationDog #OffGridAdventure #WorkingDog #FlightDog","Belgian Malinois in alert action pose at private highland airstrip, converted hangar cabin glowing amber behind, small light aircraft wing visible, golden hour","Hyper-realistic 9:16 vertical photo. A muscular, sleek Belgian Malinois stands in a sharp, commanding attention pose on the edge of a private highland grass airstrip at golden hour. The dog faces the camera directly, completely alert. Behind the dog to the left, the matte black steel wall of a converted hangar off-grid cabin glows intensely amber through its glass facade. To the right, the aluminium wing tip and tail of a small bush plane catches the golden hour light. The dog's dark tan-and-black coat absorbs the golden light beautifully, creating a powerful silhouette effect at the edges. The high altitude airstrip drops away behind into a spectacular mountain valley. No people, 8k, cinematic adventure dog aviation photography.","Ready for take-off.","Ready","May 2","Static-4","1:30pm"
"11","Wild Stay | Off-Grid Escapes","Static Image","Campers & RV / Unimog Mountain Base Camp","The Summit Rig: Unimog Expedition Base Camp | Alpine Wild Stay 2026","Save this for your expedition truck and overlander board. The ultimate off-grid Darecation — a converted Mercedes Unimog expedition truck parked on an alpine meadow at night. Pop-top tent glowing amber, EcoFlow Delta strapped to the exterior rack, a perfect star field above. #Unimog #ExpeditionTruck #Overlander #WildStay #AlpineCamp #Darecations #OffGridRV","Converted Mercedes Unimog expedition truck on alpine meadow at night, pop-top tent glowing amber, EcoFlow strapped to exterior roof rack with green LED, star field sky","Hyper-realistic 9:16 vertical photo. A hulking, battle-worn converted Mercedes Unimog 4x4 expedition truck is parked on a high alpine meadow at deep night. The massive truck features a custom overland expedition body with an elevated pop-top tent fully deployed. The interior of the pop-top tent glows intensely with warm amber light, making it look like a lantern in the wilderness. Mounted securely to the heavy exterior steel roof rack is a waterproof EcoFlow Delta Pro, its green charge LEDs bright in the dark. Above, an absolutely breathtaking star field fills the entire sky, with the Milky Way core directly above the truck. The cold blue starlight contrasts perfectly with the warm amber tent glow. Text overlay at bottom: 'Summit parked. Stars above. Unimog.' No people, 8k, cinematic extreme overlander photography.","Summit. Stars. Unimog.","Ready","May 2","Trend-Slot","3:30pm"
"12","Future Living & Off-Grid Tech","Idea Pin Video","Dome Formula / Northern Lights Timelapse Video","The Aurora Dome: Off-Grid Geodesic Timelapse | Northern Lights Video","Watch the lights dance. A timelapse above an off-grid glass dome — from black night to full aurora display. The warm amber dome stays constant as the sky transforms above it. #GeodesicDome #NorthernLights #AuroraBorealis #OffGridDome #TimeLapse #DomeLife #ArchitectureVideo","Cinematic timelapse video from above a glass geodesic dome at night, northern lights building from faint green to full display, warm amber dome glow constant throughout","Cinematic 9:16 vertical video. The video opens at total darkness on a frozen arctic tundra. In the centre of frame, a glass geodesic dome glows steadily with warm amber interior light — the only light source in the world. The camera angle is from slightly above and in front of the dome, looking up at the sky. Over the next 20 seconds of timelapse, the northern lights begin as faint green smears at the horizon, then build and surge upward into full, violent aurora waves of green and violet directly above the dome. Star trails arc across the sky simultaneously. Through all of it, the amber dome interior light remains perfectly constant — a warm, human-made anchor against the chaos of the natural light show above. EcoFlow on the snow glows green throughout. 8k, no people.","The dome watches the lights.","Ready","May 2","Video","8:30pm"
"13","Future Living & Off-Grid Tech","Static Image","Metal Art / Welded Steel Studio on Mountain Ledge","The Weld Studio: Steel + Glass Mountain Off-Grid Lab 2026","Save this for your metal art and off-grid studio board. A corrugated dark steel and glass studio built on a mountain ledge — structural I-beam frames exposed, visible heat-mark weld seams on every surface, floor-to-ceiling glass revealing a warm amber workshop inside. EcoFlow Pro exterior. This is where metal art is made. #MetalArt #WeldedSteel #OffGridStudio #SteelArchitecture #FutureLiving #GlassStudio #ExposedSteel","Dark corrugated steel and glass off-grid studio on mountain ledge with exposed I-beam frame, visible weld seams, floor-to-ceiling glass showing warm amber workshop interior, EcoFlow Pro outside","Hyper-realistic 9:16 vertical photo. A dramatic off-grid creative studio is built directly onto a rocky mountain ledge. The structure is an architectural metal art statement: corrugated dark matte steel cladding covers every surface, with exposed heavy-duty structural steel I-beams forming a raw external cage frame around the building. Every weld seam is raw, left unpainted, with gorgeous iridescent heat-mark oxidisation. One entire wall is floor-to-ceiling glass, through which a warm, amber-lit workshop interior is fully visible — workbenches, tool racks, exposed metal pieces in progress. An EcoFlow Delta Pro Max power station is mounted flush on the exterior steel cladding, its green LED display piercing the cold mountain air. The sky behind is deep blue-grey overcast, creating maximum contrast with the amber interior. No people, 8k, architectural metal art photography.","Where metal art is made.","Ready","May 3","Static-1","7:30am"
"14","Smart Pet Wellness","Static Image","Quiet Morning / Golden Retriever Dawn Door","First Light: Golden Retriever at the Off-Grid Glass Door | Dawn 2026","Save this for your golden retriever and cabin morning board. A Golden Retriever sitting just inside an open floor-to-ceiling glass door at the first light of dawn — warm amber room behind, dewy pine forest ahead. The most peaceful moment of the off-grid day. #GoldenRetriever #QuietMorning #CabinMorning #DawnLight #OffGridDog #GlassDoor #CabinLife","Golden Retriever sitting just inside open floor-to-ceiling glass cabin door at first dawn light, warm amber interior behind, dewy pine forest ahead in cool blue-green dawn","Hyper-realistic 9:16 vertical photo. A beautiful, fluffy Golden Retriever is sitting just inside the threshold of a wide-open floor-to-ceiling glass sliding door of an off-grid cabin. The camera is outside in the dawn, looking back in through the glass. The dog is peaceful, relaxed, looking out toward the camera with soft, warm eyes. The cabin interior behind the dog is bathed in rich warm amber light from low pendant lamps, creating a perfect golden rim-light through the dog's thick fur. Outside, the dawn forest is cool and dewy — the pine trees still deep blue-green in the early light, with soft mist threading between the trunks. A single bird is perched on a branch just visible in the misty background. The moment is absolutely still. No people, 8k, cinematic golden hour cabin pet photography.","First light. Best moment.","Ready","May 3","Static-2","9:30am"
"15","Future Living & Off-Grid Tech","Static Image","Dome Formula / Sea Cliff Observatory Dome","The Cliff Dome: Off-Grid Glass Observatory on the Sea Edge 2026","Save this for your off-grid dome and sea cliff board. A glass geodesic dome on a sheer sea cliff at twilight — crashing ocean 200 metres below, warm amber observatory interior blazing through every glass panel. EcoFlow on the cliff platform. The most dramatic off-grid view alive. #GeodesicDome #SeaCliff #OffGridDome #GlassDome #CliffHouse #FutureLiving #ObservatoryDome","Glass geodesic dome on sheer sea cliff at twilight, ocean 200m below, warm amber observatory interior glowing through glass panels, EcoFlow on cliff platform, dramatic sky","Hyper-realistic 9:16 vertical photo. A large glass-panel geodesic dome is anchored directly on a sheer granite sea cliff edge. Directly below the cliff — a 200-metre drop — the dark Atlantic ocean crashes and foams against the rocks in the deep blue twilight. Every glass triangle of the dome blazes with warm, rich amber interior light, creating a constellation of glowing geometric panels against the deep twilight sky. On the narrow steel-grate cliff platform, an EcoFlow Delta Pro power station is bolted to the rock face, its green LEDs reflecting off the polished steel grating. The sky above transitions from deep navy to a pale amber at the ocean horizon. The ocean spray and the cliff's raw power contrast with the warm, contained glow of the architectural dome. No people, 8k, extreme cinematic geodesic dome photography.","Cliff edge. Glass dome. Amber light.","Ready","May 3","Static-3","11:30am"
"16","Smart Pet Wellness","Static Image","Watercraft / Samoyed Float Dock","Still Water: Samoyed on the Float Dock | Off-Grid Lake Dawn 2026","Save this for your Samoyed and lake life board. A pure white Samoyed sitting on a cedar floating dock at lake dawn — the glass overwater cabin glowing amber behind it, and both the dog and cabin perfectly doubled in the mirror-flat lake reflection below. #Samoyed #FloatDock #LakeDog #OffGridLake #DockDog #SamoyedLife #FloatingCabin","White Samoyed sitting on cedar floating dock at lake dawn, glass overwater cabin glowing amber behind, perfect mirror reflection of dog and cabin in still lake water","Hyper-realistic 9:16 vertical photo. A pure white, thick-coated Samoyed is sitting perfectly still on a wide cedar plank floating dock at the break of dawn. The lake surface is absolutely mirror-flat. Behind the dog, a modern glass-fronted overwater cabin glows with warm amber interior light that spills out onto the dock and reflects as a golden column down into the dark lake water. Both the white Samoyed and the glowing amber cabin are reflected with perfect fidelity in the mirror lake below, creating a doubled image in the lower half of the frame. The mountains above the lake are still dark blue silhouettes in the pre-dawn. The warmth of the dog's white fur catches the amber cabin glow on one side. No people, 8k, cinematic dog watercraft photography.","Mirror lake. White dog.","Ready","May 3","Static-4","1:30pm"
