"Post #","Board","Post Type","Theme","Title","Description","Alt Text","AI Prompt","In-App Text Hook","Status","Posting Day","Slot","SL Post Time"
"15","Future Living & Off-Grid Tech","Static Image","Solar / Biomimicry Solar Tree Glass Cabin Forest Clearing","Biomimicry Solar Tree Glass Cabin | Off-Grid EcoTech Architecture 2026","Save this for your solar technology and eco-architecture board. A glass cabin in a forest clearing with a biomimicry solar tree — a steel tree-form structure with photovoltaic leaf panels at every branch tip, charging the EcoFlow inside the glass. When technology imitates nature at this level it becomes something else entirely. #BiomimicryDesign #SolarTree #OffGridTech #EcoArchitecture #FutureLiving #SolarPower #SustainableDesign","Biomimicry solar tree in forest clearing with matte black steel trunk branching into natural tree form with dark photovoltaic leaf panels at every branch tip, full-glass cabin with warm amber interior visible in background clearing, EcoFlow Delta Pro inside through glass, dappled golden forest light","Hyper-realistic 9:16 vertical photo, Style A Quiet Luxury. In a forest clearing, a biomimicry solar tree stands as the central visual element: a matte black steel trunk branches into multiple limbs in a natural tree form, each branch tip terminating in a rectangular photovoltaic solar panel coated in dark green-black to mimic leaves. The engineering mirrors a real tree's structure precisely to maximise light capture. In the background of the clearing: a full-glass rectangular cabin, warm amber interior completely visible through the glass. Inside, an EcoFlow Delta Pro x2 stack with all green charge LEDs. Golden afternoon light filters through the forest canopy around the clearing, dappling the forest floor. The biomimicry solar tree is framed against the glass cabin and the forest behind it. No people. 8k, cinematic eco-technology architectural photography.","Nature's blueprint. Your power.","Ready","Day 3 — Thu May 15","Static-3","11:30am"
"16","Smart Pet Wellness","Static Image","Indoor Luxury / Norwegian Forest Cat Snow Window Morning Light Cabin","Norwegian Forest Cat Snow Window Morning | Quiet Luxury Cat Photography 2026","Save this for your Norwegian Forest Cat and winter interior board. A Norwegian Forest Cat in a floor-to-ceiling snow-framed cabin window at morning light — the pine forest outside in fresh snow, that lion's mane catching the cold white light, pale green eyes watching everything. This is the window this breed was built for. #NorwegianForestCat #SnowWindow #QuietLuxury #CatLife #WinterCat #IndoorCat #CatPhotography","Large Norwegian Forest Cat with full lion's mane sitting on oak window ledge in floor-to-ceiling glass panel, fresh-snow-covered pine forest outside window, cold white diffuse morning snow light creating rim-light on outer guard coat, warm oak interior behind cat in soft bokeh","Hyper-realistic 9:16 vertical photo, Style A Quiet Luxury. A large adult Norwegian Forest Cat with a magnificent dense lion's mane sits on a wide oak window ledge in a floor-to-ceiling window in a winter cabin. Outside the window: a pine forest freshly covered in snow — every branch weighed down with pristine white powder, the forest floor a smooth unbroken white, cold grey-white morning sky. The cold diffuse snow-light from outside creates a stunning rim-light on the Norwegian Forest Cat's outer guard coat — white fur portions glow cold white, the tabby portions catch the grey light in layered detail. The warm oak interior behind the cat is visible as soft bokeh: warm wood tones contrasting with the cold snow forest beyond the glass. The cat's pale green eyes look outward with characteristic wild alertness. No people. 8k, winter morning interior cat portrait photography, cold snow light.","Cold forest. Warm interior. Wild soul.","Ready","Day 3 — Thu May 15","Static-4","1:30pm"
"17","Code. Build. Ship. — Freelance Tech Life","Static Image","Bridge / Off-Grid Architecture SaaS Platform UI on Dual Monitor Setup","Building an Off-Grid Architecture Platform | SaaS Dev Setup 2026","Save this for your SaaS startup ideas and software engineering board. Imagine a booking platform for off-grid glass cabin stays — built by a solo engineer, designed around the aesthetic. The off-grid architecture niche is an untapped SaaS vertical. This is what I build for founders with vision. Save this for when you have the idea and need the engineer. #SaaS #SoftwareEngineering #OffGridTech #StartupBuild #FreelanceDev #SaaSFounder #BuildInPublic","Dual-monitor developer setup on natural oak desk in off-grid glass cabin showing VS Code on left monitor and off-grid glass cabin booking platform UI on right monitor, pine forest through full glass wall behind, warm morning studio light, EcoFlow in corner","Hyper-realistic 9:16 vertical photo, Style A Quiet Luxury. A dual-monitor developer setup on a natural oak desk inside a full-glass cabin. Left monitor: VS Code dark theme showing TypeScript React component code — clean and well-formatted. Right monitor: a web application UI for an off-grid glass cabin booking platform — showing a listing card for 'Volcanic Rock Pod, Atlantic Coast' with a dark minimal UI, price per night, EcoFlow power indicator badge, a map thumbnail, and a 'Book this escape' button. The design aesthetic exactly matches the off-grid architecture visual vocabulary. Through the full glass wall behind the desk: a pine forest at warm morning light. No person visible. 8k, cinematic developer setup photography, glass cabin studio.","What founders dream. What I build.","Ready","Day 3 — Thu May 15","SE-Lifestyle","3:30pm"
"18","Code. Build. Ship. — Freelance Tech Life","Static Image","Infographic / Solo Founder MVP Tech Stack 2026","The 2026 MVP Tech Stack for Solo Founders | Software Engineer Guide","Save this for your startup planning and tech stack board. This is the exact tech stack a software engineer recommends to a solo founder in 2026. Fast, scalable, low ops overhead, designed to ship in 6 weeks. Save this and build your idea. #MVPStack #SoftwareEngineering #SaaSFounder #TechStack #StartupLife #IndieHacker #BuildInPublic","Dark technical infographic titled The 2026 Solo Founder MVP Stack showing a layered architecture diagram with 5 horizontal technology layers, deep charcoal background, amber-gold section header borders, white tech names, clean blueprint aesthetic","Clean technical infographic, 9:16 vertical, Style B Dynamic Viral. Background: deep charcoal with a subtle dot-grid pattern. Header in bold white sans-serif: THE 2026 SOLO FOUNDER MVP STACK. Below, a layered architecture diagram with 5 horizontal layers, each a rounded rectangle in slightly lighter charcoal with an amber-gold left border accent. Each layer: amber-gold label left, white tech names right. Layer 1 FRONTEND: Next.js 15, Tailwind CSS, Shadcn UI. Layer 2 AUTH: Clerk or Supabase Auth. Layer 3 DATABASE: Supabase Postgres or PlanetScale. Layer 4 API: tRPC or REST via Next.js API routes. Layer 5 DEPLOYMENT: Vercel plus GitHub Actions CI/CD. Footer in small amber text: Ship week 1. Iterate. Ship again. No photography. Pure technical editorial design.","Ship in 6 weeks.","Ready","Day 3 — Thu May 15","SE-Infographic","8:30pm"
"19","Future Living & Off-Grid Tech","Static Image","Glass / Steel Mesh Walkway Forest Canopy Twin Pod Dawn Architecture","Steel Walkway Forest Glass Pods | Off-Grid Treehouse Architecture 2026","Save this for your treehouse architecture and forest cabin board. Two glass pods at canopy level connected by a steel-mesh walkway — the whole system off-grid, forest floor 18 metres below, dawn light filtering through pine canopy above. The most beautiful engineering problem ever solved. #TreehouseArchitecture #ForestPod #GlassCabin #SteelWalkway #OffGridLiving #FutureLiving #CanopyLiving","Two full-glass rectangular pods in pine forest canopy at 18m height connected by open steel mesh and tubular handrail walkway, warm amber interior in both pods, long golden diagonal dawn light shafts through canopy above, forest floor in deep shadow far below, EcoFlow solar flush on pod roofs","Hyper-realistic 9:16 vertical photo, Style A Quiet Luxury. Two full-glass rectangular pod cabins are positioned in the canopy of a pine forest at 18 metres height, connected by a walkway of open steel mesh with matte black tubular steel handrails. The walkway is photographed from the midpoint looking toward the nearer pod — the glass pod glows warm amber from inside, visible through the glass walls: a minimal reading nook, an Anglepoise lamp. Dawn light filters through the pine canopy above in long golden diagonal shafts. The forest floor is 18 metres below in deep shadow. On the flat roof of each pod: flush EcoFlow solar panels in matte black. Composition: warm amber pods, golden canopy light, dark forest depth below. No people. 8k, cinematic canopy architectural photography, dawn forest light.","18 metres up. Off-grid.","Ready","Day 4 — Fri May 16","Static-1","7:30am"
"20","Smart Pet Wellness","Static Image","Wilderkind / Red Fox Autumn Forest Golden Hour Portrait","Red Fox Autumn Forest | Wilderkind Wildlife Aesthetic 2026","Save this for your Wilderkind animal aesthetic and autumn wildlife board. The red fox at absolute peak golden hour in the autumn forest — rust-red coat matching the fallen maple leaves exactly, amber eyes catching the same light as the canopy above. Nature's most perfectly colour-matched creature. #Wilderkind #RedFox #FoxPhotography #AutumnWildlife #GoldenHour #AnimalAesthetic #NaturePhotography","Red fox standing in dense autumn forest at peak golden hour, vivid rust-red coat glowing in warm amber side-light from the left matching fallen maple leaves around paws, amber-gold eyes sharp and calm looking slightly off-camera, autumn forest canopy burning gold-crimson in soft bokeh background","Hyper-realistic 9:16 vertical photo, Style A Quiet Luxury. Wilderkind aesthetic. A red fox stands in the leaf litter of a dense autumn forest at the exact moment of peak golden hour. The fox's rust-red coat is lit by the low golden light from the left — the warm backlight makes the outer guard hairs glow in luminous amber-orange, matching the fallen maple leaves scattered on the forest floor around its paws. The fox's amber-gold eyes look slightly off-camera with calm alert intelligence. The autumn forest behind: maple canopy burning gold-crimson-amber in completely soft bokeh. The fox's black ear tips and paw markings create sharp contrast accents. Shot from low ground level — the fox at camera height. No people. 8k, golden hour wildlife portrait photography, autumn forest, low angle.","Same colour as the forest.","Ready","Day 4 — Fri May 16","Static-2","9:30am"
"21","Future Living & Off-Grid Tech","Static Image","Interior / Stone Fireplace Metal Frame Glass Cabin Winter Night Quiet Luxury","Stone Fireplace Metal Glass Cabin Interior | Off-Grid Winter Quiet Luxury 2026","Save this for your cabin interior and quiet luxury home board. Inside the off-grid glass cabin on the coldest night. Raw stone fireplace. Exposed matte black steel frame at the glass junction. Birch logs burning. Jackery fully charged. Deep snow outside. This interior was designed for exactly this moment. Save this. #CabinInterior #QuietLuxury #StoneFireplace #GlassCabin #OffGridLiving #WinterInterior #FireplaceAesthetic","Interior of off-grid glass cabin in deep winter night, raw rough-cut stone fireplace with birch log fire burning, exposed matte black steel structural frame at glass wall junction, cream linen platform bed in background, Jackery Explorer wall-mounted with full green charge, deep snow visible through glass","Hyper-realistic 9:16 vertical photo, Style A Quiet Luxury. Interior shot of a minimal off-grid glass cabin in deep winter. Central element: a raw stone fireplace — rough-cut local stone stacked floor to ceiling, a deep firebox with a real birch log fire burning, firelight casting warm amber on the stone face. Adjacent: the junction of a full glass wall panel and a matte black steel structural frame — the steel beam is exposed and raw, the glass beyond shows a snow-covered exterior landscape in deep blue-grey. On the far wall: a cream linen platform bed, an oak bedside table, a Jackery Explorer 2000 Pro mounted to the wall with green LED at full charge. Firelight is the dominant light source: warm amber falling across stone, steel, glass, and linen. Material palette: raw stone, matte black steel, full glass, cream linen, warm oak. No people. 8k, cinematic winter interior architectural photography, firelight.","Stone. Steel. Glass. Fire.","Ready","Day 4 — Fri May 16","Static-3","11:30am"
"22","Smart Pet Wellness","Static Image","Adventure / Golden Retriever Rocky Tidal Pool Volcanic Coast Golden Hour","Golden Retriever Rocky Tidal Pool | Coastal Adventure Dog Photography 2026","Save this for your golden retriever and coastal adventure board. A golden retriever stepping through a mirror-still tidal pool on black volcanic rock at golden hour — its reflection in the still water below, the Atlantic horizon behind, gold on black. Every frame a masterclass in colour. #GoldenRetriever #CoastalDog #TidalPool #BeachDog #AdventureDog #GoldenHour #DogPhotography","Golden Retriever walking through completely still shallow tidal pool set in black volcanic rock at golden hour, dog and golden sky perfectly reflected in mirror-still tidal water below, Atlantic Ocean horizon behind in hammered gold, golden fur lit by warm side-light","Hyper-realistic 9:16 vertical photo, Style A Quiet Luxury. A golden retriever walks calmly through a shallow tidal pool set in black volcanic rock at golden hour. The tidal pool water is completely still — the dog's body, golden fur, and the entire golden hour sky above are reflected perfectly in the mirror-still pool water below the dog. The black volcanic rock surrounds the tidal pool in all directions. The Atlantic Ocean behind stretches to the hammered gold horizon. The golden retriever's coat catches the golden hour side-light in warm luminous gold, every strand of fur illuminated. Photographed from low angle — the composition shows dog above and perfect reflection below in near-equal halves, the ocean filling the upper background. No people. No leash visible. 8k, golden hour coastal dog portrait photography, tidal pool reflection.","Gold on black volcanic rock.","Ready","Day 4 — Fri May 16","Static-4","1:30pm"
"23","Code. Build. Ship. — Freelance Tech Life","Static Image","Bridge / Pre-Dawn Engineer Morning Ritual Off-Grid Glass Cabin Setup","The Off-Grid Engineer Morning Ritual | Software Dev Aesthetic 2026","Save this for your remote work aesthetic and developer lifestyle board. 5:45am. Glass cabin. Pine forest invisible in the dark. Dark theme. Black coffee. This is what a software engineer's morning looks like when you build the life around the work. The clients find you when the work speaks for itself. #RemoteDev #SoftwareEngineer #MorningRoutine #OffGridWork #DeveloperLife #FreelanceDev #WorkFromAnywhere","Pre-dawn developer setup at 5:45am in glass cabin, laptop with dark-theme terminal open showing Node.js server starting in green text on black, black ceramic coffee mug with steam, Anglepoise lamp as only light source, Jackery powering setup, pine forest invisible in total darkness outside glass wall","Hyper-realistic 9:16 vertical photo, Style A Quiet Luxury. Pre-dawn, 5:45am. The interior of a glass cabin visible only by the glow of a single matte black Anglepoise lamp and a 16-inch MacBook Pro screen. Outside the full glass wall: absolute darkness — the pine forest is an invisible presence. The desk: natural oak, one matte black ceramic coffee mug with steam rising, the MacBook screen showing a dark-theme VS Code terminal with a Node.js server starting — green text on black. The lamp creates a tight pool of warm amber light on the desk surface. In the corner, a Jackery Explorer 2000 Pro with green charge bar is the only other light source in the frame. No person visible — just the setup, the code, the coffee, the dark glass. 8k, pre-dawn developer setup photography, moody dark ambient lighting.","5:45am. Dark theme. Ship it.","Ready","Day 4 — Fri May 16","SE-Lifestyle","3:30pm"
"24","Code. Build. Ship. — Freelance Tech Life","Static Image","Infographic / 5 Signs a Startup Needs a Software Engineer Right Now","5 Signs a Startup Needs a Software Engineer Right Now | Founder Guide 2026","Save this for your startup founding and tech hiring board. If your startup is showing any of these 5 signals, you need a software engineer now — not in Q3. Save this and share it with your co-founder. The right engineer pays for themselves in week two. #SaaSFounder #StartupLife #SoftwareEngineering #HiringTech #TechFounder #IndieHacker #BuildInPublic","Dark minimal vertical infographic titled 5 Signs You Need a Software Engineer Now with 5 numbered warning signals, small amber warning triangle icons beside each item, deep charcoal background, amber-gold accent elements, clean editorial typography","Clean editorial infographic, 9:16 vertical, Style B Dynamic Viral. Background: deep charcoal. Header in bold white: 5 SIGNS YOU NEED A SOFTWARE ENGINEER. NOW. Below, 5 numbered items each with a small amber-gold warning triangle icon: 1. Your no-code tool is hitting its ceiling — you're paying $800 per month for something a developer could own forever. 2. Your API integrations keep breaking — no one on your team can debug a webhook. 3. You're about to raise a pre-seed round — investors will ask who built this. 4. Your competitor just shipped a feature you've been planning for 6 months. 5. You're manually doing something 50 times a day that could be automated in a weekend. Footer in amber: The right engineer pays for themselves in week two. Colour: charcoal, amber, white. No photography.","The right engineer pays for themselves.","Ready","Day 4 — Fri May 16","SE-Infographic","8:30pm"
"25","Future Living & Off-Grid Tech","Static Image","Glass / Alpine Steel Solar Pod Mountain Summit Morning Mist","Alpine Steel Solar Pod Mountain Summit | Off-Grid Architecture 2026","Save this for your alpine architecture and off-grid living board. A steel-and-glass pod at 2,400m — the summit mist clearing to reveal the mountain horizon panorama, solar array on the roof catching first altitude light, EcoFlow inside at full charge. Architecture that belongs at the top of the world. #AlpineArchitecture #MountainCabin #OffGridLiving #FutureLiving #SteelAndGlass #SolarPower #SummitCabin","Compact matte black steel framed full-glass pod on bare alpine rock at 2400m altitude, summit mist partially clearing on one side to reveal mountain horizon in cold blue-grey, 4-panel solar array flush on flat roof, EcoFlow Delta Pro inside with all green LEDs, warming sunrise breaking through mist on distant peaks","Hyper-realistic 9:16 vertical photo, Style A Quiet Luxury. A compact steel-framed full-glass pod sits on bare alpine rock at approximately 2,400 metres altitude. The matte black steel structural frame is exposed at corners and roof edge — structural expressionism, nothing hidden. A 4-panel solar array is flush-mounted on the flat pod roof at optimal sun angle. Inside the glass: an EcoFlow Delta Pro x2 stack with all green charge LEDs, a minimal sleeping platform, a stainless steel flask on a ledge. The summit mist is partially clearing — one side of the pod faces open mountain horizon panorama in cold blue-grey, the other side still wrapped in clearing white mist. Warming sunrise light breaks through the mist on distant mountain faces. Bare grey alpine rock surrounds the pod base. No people. 8k, cinematic alpine architectural photography, summit mist.","Summit. Solar. Clear.","Ready","Day 5 — Sat May 17","Static-1","7:30am"
"26","Smart Pet Wellness","Static Image","Wilderkind / Black Jaguar Rainforest Canopy Night Portrait","Black Jaguar Rainforest Canopy Night | Wilderkind Wildlife Aesthetic 2026","Save this for your Wilderkind animal aesthetic and big cat board. The black jaguar in the Amazonian rainforest canopy at night — the ghost of the Americas, rosette pattern barely visible in the black coat in moonlight, gold eyes burning against the absolute green darkness. Power and stillness in one frame. #Wilderkind #BlackJaguar #Jaguar #BigCat #RainforestWildlife #AnimalAesthetic #NightWildlife","Black jaguar perched on broad tropical tree branch in rainforest canopy at night, vivid gold eyes burning directly at camera, faint rosette pattern barely visible in black coat in filtered moonlight, glossy tropical leaves pressing in from all sides, mysterious deep green darkness","Hyper-realistic 9:16 vertical photo, Style A Quiet Luxury. Wilderkind aesthetic. A black jaguar is perched on a broad tropical tree branch in the Amazonian rainforest canopy at night. The coat appears pure black but in the faint moonlight filtering through the canopy, the rosette pattern is just barely visible — ghost markings in the black coat. The jaguar's gold eyes are the most vivid element in the frame — bright, burning, looking directly into the camera with absolute predatory calm. The surrounding rainforest canopy presses in: broad glossy tropical leaves, vines, deep green darkness. Moonlight picks out the jaguar's shoulders and the branch it rests on. Shot from slightly lower angle — the jaguar above and ahead. No people. 8k, night wildlife portrait photography, tropical canopy, mysterious atmosphere.","The ghost of the canopy.","Ready","Day 5 — Sat May 17","Static-2","9:30am"
"27","Future Living & Off-Grid Tech","Static Image","Glass / Stilted Glass Pod Turquoise Reef Bay Crystal Water","Stilted Glass Pod Turquoise Bay | Off-Grid Overwater Architecture 2026","Save this for your ocean architecture and off-grid escape board. A minimal glass pod on steel stilts above crystal turquoise reef water — the coral reef visible through the glass floor panels below, EcoFlow solar on the white roof, the deep ocean horizon beyond. The most transparent off-grid structure ever built. #OverwaterArchitecture #GlassPod #TurquoiseWater #OffGridLiving #FutureLiving #CoralReef #OceanCabin","Full-glass rectangular pod on slender matte white steel stilts above crystal clear turquoise shallow reef water, coral reef and tropical fish clearly visible through glass floor panels from elevated angle, EcoFlow solar panels flush on white flat roof, deep indigo open ocean beyond fringe reef, warm tropical overhead light","Hyper-realistic 9:16 vertical photo, Style A Quiet Luxury. A perfectly rectangular full-glass pod cabin elevated on slender matte white steel stilts above shallow turquoise reef water — the water is crystal clear, the coral reef and tropical fish clearly visible through the glass floor panels of the pod from a slightly elevated viewing angle. The pod exterior: white and glass. Interior: white minimal — a low bed with white linen, a hanging pod lamp, a natural palm-weave mat. On the flat white roof: EcoFlow solar panels flush-mounted, matte black on white. Around the pod: turquoise shallow reef water extends to the fringe reef edge, beyond which the deep ocean is dark indigo. The tropical light is warm and direct. Composition allows the reef through the glass floor to be simultaneously visible with the open ocean horizon beyond. No people. 8k, cinematic overwater architectural photography, tropical turquoise palette.","Coral reef below. Open ocean beyond.","Ready","Day 5 — Sat May 17","Static-3","11:30am"
"28","Smart Pet Wellness","Static Image","Indoor Luxury / Siberian Cat Glass Corner Two-Light Winter Interior","Siberian Cat Glass Corner Morning Winter | Quiet Luxury Cat Photography 2026","Save this for your Siberian cat and quiet luxury interior board. The Siberian cat in a floor-to-ceiling glass corner where two panels meet — warm golden morning light from one direction, cold pine forest diffuse light from the other. That triple-layer coat illuminated by both simultaneously. The rarest combination of breed and natural light. #SiberianCat #QuietLuxury #CatPhotography #LuxuryCat #IndoorCat #GlassInterior #CatLife","Large Siberian cat sitting in interior corner where two floor-to-ceiling glass panels meet at right angle, winter pine forest visible through both glass panels, warm golden morning sun light from left panel creating warm rim-light, cold diffuse forest light from right panel, triple-layer coat lit in two contrasting colours","Hyper-realistic 9:16 vertical photo, Style A Quiet Luxury. A large adult Siberian cat — with its famously dense triple-layer waterproof coat, broad face, and gentle disposition — sits in the interior corner where two floor-to-ceiling glass wall panels meet at right angles in a glass cabin. Through one glass panel: a sun-lit winter morning with low golden light streaming in. Through the other glass panel: a cold pine forest in deep shade, cold diffuse light. The two contrasting light sources illuminate the Siberian's extraordinary coat simultaneously: warm amber from the sunny side, cold blue-grey from the forest side. The cat looks slightly toward the warmer window with relaxed contentment. The interior warm oak floor is visible beneath the cat. No people. 8k, quiet luxury cat portrait photography, two-point natural light contrast, glass corner composition.","Two lights. One extraordinary coat.","Ready","Day 5 — Sat May 17","Static-4","1:30pm"
