"Post #","Board","Post Type","Theme","Title","Description","Alt Text","AI Prompt","In-App Text Hook","Status","Posting Day","Slot","SL Post Time"
"1","Future Living & Off-Grid Tech","Static Image","Glass / Cantilevered Crystal Bay Pod Turquoise Water","Cantilevered Crystal Bay Glass Pod | Hyper-Minimalist Overwater Architecture 2026","Save this for your tropical architecture and off-grid escape board. A full-glass cantilevered pod floating above crystal turquoise water — the reef visible through the glass floor, EcoFlow on the exterior steel bracket, the bay horizon stretching infinitely. Architecture that erases the line between indoors and nature. #OverwaterArchitecture #GlassPod #TropicalCabin #OffGridLiving #FutureLiving #CrystalWater #EcoArchitecture","Minimalist full-glass rectangular pod cantilevered over crystal turquoise bay water, transparent glass floor showing coral reef and tropical fish below, EcoFlow Delta Pro mounted on exterior steel bracket, warm amber interior, infinite ocean horizon at golden hour","Hyper-realistic 9:16 vertical photo, Style A Quiet Luxury. A perfectly rectangular full-glass pod is cantilevered on a single steel beam directly above crystal turquoise bay water. Through the transparent glass floor of the pod, the coral reef and tropical fish are clearly visible below. The pod interior glows warm amber: a platform daybed, a minimalist desk, hanging woven baskets. An EcoFlow Delta Pro is mounted on an exterior steel bracket on the pod's side — green LED bars at full charge. The turquoise water is so clear and still that it reflects the pod perfectly. The ocean horizon fills the background in hammered gold at golden hour. No people. 8k, cinematic cantilevered overwater architecture, crystal water reflection.","Reef visible through glass.","Ready","Day 1 — Tue May 22","Static-1","7:30am"
"2","Smart Pet Wellness","Static Image","Adventure / Golden Retriever Misty Fjord Sunrise Sprint","Golden Retriever Fjord Sunrise Mist | Adventure Dog Golden Hour Photography 2026","Save this for your golden retriever and Nordic adventure board. A golden retriever at full sprint through coastal fjord mist at sunrise — the golden fur catching the first amber light, the mist parting, perfect paw extension frozen in time. This is what adventure looks like with a dog that was born for this. #GoldenRetriever #FjordDog #SunriseSprint #AdventureDog #MorningRun #DogPhotography #MistDog","Golden Retriever at full gallop through thick fjord mist at sunrise, all four paws airborne at peak stride, golden coat backlit by warm amber sunrise light, white chest and feathering illuminated, steep granite fjord cliff behind in blue-grey silhouette","Hyper-realistic 9:16 vertical photo, Style A Quiet Luxury. Shot at ground level at the precise moment of peak sunrise. A golden retriever at full gallop directly toward camera through thick white mist on a fjord beach, all four paws off the ground at peak stride extension. The golden coat is heavily backlit by the low warm amber sunrise light on the left, creating a luminous rim-light effect on the outer coat and white chest feathering. The white portions glow gold in the backlight. Thick mist swirls around the dog's legs and body. Behind the dog: a massive granite fjord cliff in deep blue-grey silhouette. The mist is thickest at ground level. No people. 8k, sunrise fjord dog photography, atmospheric mist, golden backlight.","Mist. Golden light. Pure motion.","Ready","Day 1 — Tue May 22","Static-2","9:30am"
"3","Future Living & Off-Grid Tech","Static Image","Glass / Minimalist Snow-Framed Alpine Pod Summit Architecture","Alpine Summit Glass Pod Winter Solitude | Snow-Frame Architecture 2026","Save this for your alpine architecture and minimal cabin board. A minimal glass pod at tree line above the snow layer — the pod emerging from the clouds, interior warm amber, the snow-covered mountains stretching below. You built a room inside the silence. #AlpineArchitecture #GlassCabin #MountainPod #OffGridLiving #FutureLiving #MinimalInterior #SnowArchitecture","Minimal rectangular glass pod at alpine tree line on bare rock, snow layer forming cloud base below pod creating natural white frame, warm amber interior visible through all glass walls, deep blue-black sky above pod at high altitude, EcoFlow on platform ledge","Hyper-realistic 9:16 vertical photo, Style B Dynamic Viral. A minimal rectangular full-glass pod sits on bare rock at the alpine tree line — at the precise altitude where the snow-covered landscape below forms a layer of white clouds/snow meeting the base of the pod. The pod appears to be floating above a sea of white. The interior: warm amber light, a minimal sleeping platform, stacked cream books, an EcoFlow Delta Pro with green LEDs in the corner. The glass walls frame the view perfectly. Above the pod: a deep blue-black alpine sky and pale stars. No trees visible, just bare rock and the pod. Bold white text overlay at bottom: ""ABOVE THE CLOUDS. OFF-GRID. ALIVE."" No people. 8k, alpine pod architecture photography, snow frame composition.","Above the clouds.","Ready","Day 1 — Tue May 22","Static-3","11:30am"
"4","Smart Pet Wellness","Static Image","Indoor Luxury / Black Norwegian Forest Cat Window Perch Snowy Afternoon","Black Norwegian Forest Cat Snow Window Afternoon | Wild Interior Photography 2026","Save this for your Norwegian Forest Cat and cosy interior board. A black Norwegian Forest Cat on a deep window ledge — outdoors: fresh snow and pine forest; indoors: warm golden afternoon light. That dense coat catches both the cold forest light and the warm interior glow simultaneously. #NorwegianForestCat #BlackCat #SnowWindow #QuietLuxury #CatLife #CozyInterior #IndoorCat","Large black Norwegian Forest Cat with full dense coat sitting on wide oak window ledge in floor-to-ceiling window, snowy pine forest visible through glass, warm golden afternoon light from interior creating rim-light on cat's outer coat, deep shadow undercoat detail visible","Hyper-realistic 9:16 vertical photo, Style A Quiet Luxury. A large black Norwegian Forest Cat with its characteristic dense double coat sits on a deep wood window ledge inside a cabin, directly against a floor-to-ceiling window. Outside the glass: a snowy pine forest, snow clinging to every branch, cool grey-white diffuse light. Inside: warm golden afternoon light from a side window creates a warm rim-light on the cat's black outer guard coat — the light hits the very edge of the fur, creating a thin luminous line against the dark coat. The cat's gold eyes look outward with that characteristic wild alertness. Interior: warm oak, cream wool blanket on a chair behind, soft bokeh. No people. 8k, quiet luxury interior cat portrait, dual-light contrast window composition.","Black coat. Two lights.","Ready","Day 1 — Tue May 22","Static-4","1:30pm"
"5","Code. Build. Ship. — Freelance Tech Life","Static Image","Bridge / Mobile App Dev Workspace Glass Cabin Mountain View","Building Pet Wellness Mobile App | Developer Mountain Studio 2026","Save this for your mobile app development and startup ideas board. A software engineer building the next pet health app — the phone design interface on screen, the raw glass cabin workspace visible through the display, mountain snow peaks outside. Founders hire the engineer whose workspace tells your story. Save this. #MobileAppDev #AppDesign #SoftwareEngineer #FreelanceDev #PetTech #StartupBuild #DevSetup","iPhone 16 Pro on natural wood desk displaying pet health mobile app UI with dog health metrics dashboard, glass cabin interior in soft bokeh behind phone, snow mountain peaks visible through glass wall, warm morning studio light","Hyper-realistic 9:16 vertical photo, Style A Quiet Luxury. An iPhone 16 Pro is propped on a natural oak desk in a full-glass cabin studio. The phone screen shows a clean, modern pet health mobile app UI: a dog profile card with a health metrics dashboard (heart rate ring, activity streak, medication reminders), a vet appointment scheduler showing 'Dr. Chen - Tuesday 2pm', a weight tracking graph with a golden retriever silhouette icon. The design is minimal, pastel on white. Behind the phone in soft bokeh: the warm cabin interior, wooden furniture. Through the full glass wall behind: snow-covered mountain peaks in deep blue and white. A single Anglepoise lamp in matte black on the desk. No person visible. 8k, cinematic mobile app design photography, glass cabin mountain backdrop.","Build the app founders need.","Ready","Day 1 — Tue May 22","SE-Lifestyle","3:30pm"
"6","Code. Build. Ship. — Freelance Tech Life","Static Image","Infographic / AI Integration Engineer 2026 Demand Signals","Why AI Integration Engineers Are the Highest-Paid Freelance SE Role in 2026","Save this for your freelance career and tech job market board. AI Integration Engineers are closing more clients at 40% higher rates than full-stack devs in 2026. This is the breakdown. Save this if you code. #SoftwareEngineer #AIIntegration #CareerGrowth #FreelanceSE #TechJobs #IndieHacker #BuildInPublic","Dark editorial infographic showing 5 client demand signals for AI integration engineers with upward trending bars and salary comparison charts, charcoal background with amber accent numbers and upward arrow motifs","Clean editorial infographic, 9:16 vertical, Style B Dynamic Viral. Background: deep charcoal (#1a1a1a). Title in bold white at top: 5 DEMAND SIGNALS FOR AI INTEGRATION ENGINEERS 2026. Below, 5 numbered sections each with an upward amber-gold arrow icon. Section 1: Enterprise LLM Integration — Large orgs desperate for OpenAI/Claude/Bedrock expertise. Section 2: Founding Teams — Every new SaaS founder saying 'add AI to our product'. Section 3: Salary Floor — $120k/year solo contractor minimum vs $95k/year for full-stack. Section 4: Project Speed — Close new clients in 1 month instead of 3. Section 5: 0-to-$50k/month — AI Integration specialists hitting this faster than any other niche. Footer stats: Avg project length 6–8 weeks, 3–5 clients annually. Colour: charcoal, amber-gold, white. No photography.","40% higher rates. 2026.","Ready","Day 1 — Tue May 22","SE-Infographic","8:30pm"
"7","Future Living & Off-Grid Tech","Static Image","Glass / Fjord Peninsula Glass Cabin Dramatic Cliff Edge Dawn","Fjord Peninsula Glass Cabin Cliff Edge Dawn | Dramatic Off-Grid Architecture 2026","Save this for your cliff architecture and dramatic landscape board. A glass cabin on a narrow peninsula — the fjord wrapping around on both sides far below, dawn light just breaking on the horizon, EcoFlow on the cliff-edge terrace. Standing in a room of glass 150 metres above water. #CliffCabin #GlassPod #FjordArchitecture #OffGridLiving #FutureLiving #DramaticArchitecture #ArchitectureDesign","Full-glass rectangular cabin perched on narrow rocky fjord peninsula, both sides dropping vertically 150m to fjord water, dark water visible on both left and right of peninsula far below, dawn rose-pink light breaking on horizon, EcoFlow Delta Pro on cliff-edge exterior platform terrace with green LEDs, minimal interior","Hyper-realistic 9:16 vertical photo, Style A Quiet Luxury. A rectangular full-glass cabin is perched on the apex of a narrow rocky fjord peninsula — on both the left and right sides of the peninsula, the fjord water is visible far below, 150 metres down. The narrow rocky ridge connects the peninsula to the mountain behind. The glass cabin sits at the peninsula tip looking out over the open fjord. Inside: warm amber interior, a platform bed facing the fjord, minimal furnishings. An EcoFlow Delta Pro is on the cliff-edge exterior platform — green charge LEDs visible. Dawn light: rose-pink breaking on the dark water horizon. The glass walls frame both sides of the fjord simultaneously. Shot to emphasize the precarious peninsula location. No people. 8k, cinematic fjord peninsula architectural photography, dramatic cliff composition.","Both sides drop to water.","Ready","Day 2 — Wed May 23","Static-1","7:30am"
"8","Smart Pet Wellness","Static Image","Wilderkind / Eurasian Lynx Taiga Snow Forest Twilight Portrait","Eurasian Lynx Taiga Twilight | Wilderkind Snow Cat Photography 2026","Save this for your Wilderkind animal aesthetic and big cat board. The Eurasian Lynx in the taiga at twilight — tufted ears catching the last cold light, those piercing amber eyes, the boreal forest behind in deep purple shadow. Wilderkind: the look of an animal that owns its landscape. #Wilderkind #EurasianLynx #WildlifeTaiga #BigCat #NaturePhotography #TaigaForest #AnimalAesthetic","Large Eurasian Lynx in snow-covered taiga forest at twilight, distinctive black ear tufts fully erect and backlit, piercing amber eyes locked at camera, fur rimlit by cool twilight light, deep purple taiga forest in bokeh background, fresh snow on ground and branches","Hyper-realistic 9:16 vertical photo, Style A Quiet Luxury. Wilderkind aesthetic. A large adult Eurasian Lynx stands in the snow-covered taiga forest at twilight. The lynx's most distinctive features are sharp: the black ear tufts fully erect and backlit by the cold twilight light, creating a luminous outline. Piercing amber eyes look directly at camera with alert predatory composure. The dense winter coat is rimlit by the blue-grey twilight light, particularly visible on the cheeks and shoulders. Fresh snow covers the ground and hangs on the taiga spruce branches around the lynx. The forest behind: deep purple shadow, boreal forest depth. Shot from slightly lower angle — the lynx above. No people. 8k, twilight wildlife portrait photography, taiga forest, cold light.","The animal owns the landscape.","Ready","Day 2 — Wed May 23","Static-2","9:30am"
"9","Future Living & Off-Grid Tech","Static Image","Solar / Glass Cabin Solar Array Rooftop Mountain Prairie Design","Glass Cabin Solar Array Prairie | Off-Grid EcoTech Design 2026","Save this for your solar technology and sustainable architecture board. A glass cabin on a mountain prairie with an integrated solar array on the slanted roof — the panels designed to be architectural elements, not afterthoughts. EcoFlow charging inside. Energy independence starts with beautiful design. #SolarArchitecture #OffGridLiving #SolarPower #FutureLiving #SustainableDesign #EcoArchitecture #GreenEnergy","Full-glass cabin on mountain prairie with integrated rooftop solar array angled at 35 degrees perfectly positioned by mountain horizon, matte black solar panels designed as architectural element, warm amber interior visible through glass, EcoFlow with green LEDs inside cabin, rolling prairie grass and wildflowers around foundation","Hyper-realistic 9:16 vertical photo, Style B Dynamic Viral. A full-glass cabin sits on a mountain prairie surrounded by rolling grass and wildflowers. The cabin roof is not a flat roof but a sophisticated angled design — integrated solar panels (matte black) are positioned as architectural elements at precisely 35 degrees to catch the mountain-horizon sunlight. The solar panels are not bolted on afterthoughts; they are the roof structure itself. The glass walls reveal the warm interior: an EcoFlow Delta Pro in the corner with all green charge LEDs, minimal furnishings, a platform bed. The mountain horizon behind: rolling prairie meeting distant blue mountains. The light: golden hour, casting long shadows of the solar array across the prairie grass. Bold text overlay at bottom in white: THE ROOF CHARGES YOU. NO COMPROMISES. No people. 8k, cinematic solar cabin architecture, prairie landscape.","The roof charges you.","Ready","Day 2 — Wed May 23","Static-3","11:30am"
"10","Smart Pet Wellness","Static Image","Indoor Luxury / Siberian Cat Marble Fireplace Resting Portrait","Siberian Cat Marble Fireplace Lounge | Quiet Luxury Interior Cat 2026","Save this for your Siberian cat and luxe interior board. The Siberian cat resting on a plush daybed next to a marble fireplace — the fireplace warm with a small fire, the cat's triple-layer coat catching the firelight and golden afternoon light simultaneously. Interior luxury redefined. #SiberianCat #MarbleFireplace #QuietLuxury #CatLife #LuxuryInterior #CatPhotography #CozyHome","Large fluffy Siberian cat resting on cream linen daybed beside marble fireplace with small fire burning, firelight creating warm amber glow on cat's triple-layer coat, afternoon light through hidden window adding golden rim-light on fur, marble fireplace white and grey, intimate interior setting","Hyper-realistic 9:16 vertical photo, Style A Quiet Luxury. A large fluffy Siberian cat rests on a plush cream linen daybed positioned directly beside an elegant white marble fireplace. Inside the fireplace: a small birch log fire burning with real flames, creating warm amber light. The firelight falls across the Siberian cat's extraordinary triple-layer coat, illuminating the texture — the outer guard hairs, the thick undercoat visible in layers. Warm afternoon light from a side source adds a complementary golden rim-light on the opposite side of the cat. The cat's large eyes are half-closed in contentment. The interior: minimalist luxury — white marble fireplace, cream linen daybed, a single amber glass on a side table, warm oak floor. No people. 8k, quiet luxury interior cat portrait, dual-light fireplace composition.","Firelight. Luxury. Cozy.","Ready","Day 2 — Wed May 23","Static-4","1:30pm"
"11","Code. Build. Ship. — Freelance Tech Life","Static Image","Bridge / No-Code to Custom Code Migration Workspace","Migrating from No-Code to TypeScript | The Upgrade That Launched a SaaS","Save this for your SaaS migration and tech founder board. A developer at a glass cabin desk working on a migration project — the old no-code tool on one monitor (Bubble, Zapier), the new TypeScript codebase on the other. This is what founders do when they've found product-market fit and need to scale. #SaaS #MigrationEngineering #TypeScript #SoftwareEngineer #FreelanceDev #StartupScale #TechFounder","MacBook Pro and secondary monitor on oak desk in glass cabin showing Bubble UI on left screen and VS Code TypeScript on right screen, migration workflow visible, pine forest through glass wall, warm studio morning light","Hyper-realistic 9:16 vertical photo, Style A Quiet Luxury. A workspace inside a full-glass cabin at morning light. Two screens: Left monitor displays a Bubble no-code interface with a database schema and API workflow builder visible. Right monitor: VS Code with a TypeScript codebase showing React components and a migration mapping file. The desk: natural oak, minimal. A coffee mug with steam. An Anglepoise lamp. Through the full glass wall behind the monitors: a dense pine forest in morning light. The glass reflects both the code and the forest simultaneously. An implicit narrative: a founder scaled past no-code and hired a developer to build custom. No person visible. 8k, cinematic developer workspace photography, migration project setup.","Scaled past no-code.","Ready","Day 2 — Wed May 23","SE-Lifestyle","3:30pm"
"12","Code. Build. Ship. — Freelance Tech Life","Static Image","Infographic / API & Webhook Automation Stack for Solo Makers","The API Automation Stack Every Maker Needs in 2026 | Zapier-Killer Workflows","Save this for your automation and no-code board. This is the API-first automation architecture that solo makers use to replace $500/month Zapier bills with custom $50/month infrastructure. Save this and build it. #API #Automation #Webhooks #SoftwareEngineer #NoCode #Maker #IndieHacker","Dark technical infographic showing layered API stack architecture with 4 integration layers and cost comparison chart, charcoal background with amber borders and ascending cost-savings graph on right side, clean blueprint aesthetic","Clean editorial infographic, 9:16 vertical, Style B Dynamic Viral. Background: deep charcoal with blueprint grid lines. Title in bold white: THE API AUTOMATION STACK 2026 — Replace Zapier. Below, 4 horizontal layers each showing API integration patterns. Layer 1 SOURCES: Stripe, SendGrid, GitHub Webhooks feeding into custom endpoint. Layer 2 PROCESSOR: Node.js with Bull job queue (Redis-backed) processing incoming webhooks. Layer 3 ACTIONS: Conditional logic routing to Slack, email, database updates, Notion, Airtable. Layer 4 STORAGE: PostgreSQL + S3 for logging and audit trail. Right side: Cost comparison chart — Zapier ($500/month) vs Custom API stack ($47/month infrastructure + 40 hours one-time dev). Footer: Build once. Runs forever. Scale to billions of requests. Colour: charcoal, amber-gold, white. No photography.","Build once. Scale forever.","Ready","Day 2 — Wed May 23","SE-Infographic","8:30pm"
"13","Future Living & Off-Grid Tech","Static Image","Glass / Thermal Pool Glass Cabin Icelandic Geothermal Design","Icelandic Geothermal Glass Cabin | Thermal Pool Off-Grid Architecture 2026","Save this for your Iceland architecture and geothermal off-grid board. A glass cabin built at the edge of a natural thermal pool — the steaming water visible through the glass, the cabin warming itself from the earth below, EcoFlow as backup only. Architecture powered by geology. #GeothermalArchitecture #ThermalPool #IcelandCabin #OffGridLiving #FutureLiving #SustainableDesign #GlassArchitecture","Minimal glass cabin at edge of steaming turquoise geothermal thermal pool, steam rising from hot water visible through floor glass panels of cabin, warm interior amber glow from geothermal heat, minimal EcoFlow backup system in corner visible through glass, dark Icelandic lava rock landscape around pool","Hyper-realistic 9:16 vertical photo, Style A Quiet Luxury. A minimal rectangular full-glass cabin is built directly at the edge of a natural Icelandic geothermal thermal pool. The water is a striking turquoise colour from mineral content — steam rises in thick white plumes from the hot water. Through the transparent glass floor panels of the cabin: the turquoise thermal water is visible below. The cabin interior: warm amber glow — this warmth comes from the geothermal heat rising through the floor. Minimal furnishings: a low platform bed, a small desk, a cup of hot water. In the corner: a small EcoFlow system as backup only, barely used. Dark Icelandic lava rock surrounds the pool. The glass walls frame the steam and the geothermal landscape. No people. 8k, cinematic geothermal cabin architecture, steam and mineral-water colour.","Powered by the Earth.","Ready","Day 3 — Thu May 24","Static-1","7:30am"
"14","Smart Pet Wellness","Static Image","Adventure / Pembroke Corgi Snow Forest Run Morning Light","Corgi Snow Forest Morning Run | Winter Adventure Dog Photography 2026","Save this for your Corgi and winter adventure board. A Corgi at full sprint through a snow-covered pine forest at morning light — those short legs churning through fresh snow, breath visible in cold air, morning mist between the trees, pointing ears forward with pure joy. #Corgi #PembrokeWelsh #WinterDog #SnowForest #AdventureDog #MorningRun #DogPhotography","Pembroke Welsh Corgi at full gallop through fresh snow in dense pine forest at morning light, all four paws leaving snow spray, breath visible as white vapor, pointed ears forward, low to ground but fully airborne at peak stride, morning mist between trees, boreal forest aesthetic","Hyper-realistic 9:16 vertical photo, Style A Quiet Luxury. A Pembroke Welsh Corgi at full gallop through deep fresh snow in a dense pine forest at morning light. Shot from ground level — the Corgi is captured at peak stride, all four paws off the ground and airborne, snow spraying up around the dog's legs. The fox-red and white coat contrasts beautifully against the white snow. Breath is visible as white vapor in the cold air. The Corgi's pointed ears are fully erect, focused forward with pure joy and purpose. The forest around: tall dense snow-laden pine trees, morning mist rising between the trunks in thin bands, cold blue-grey morning light filtering through. Fresh snow without tracks visible. No people or leash. 8k, morning snow forest dog photography, ground level, winter light.","Short legs. Big spirit.","Ready","Day 3 — Thu May 24","Static-2","9:30am"
